PostID,UserID,PostType,Content,RecipientID,Visible,CreationTime
207,785,Message,vivamus vestibulum sagittis sapien cum sociis natoque penatibus,723,true,2024-01-10 12:29:38
208,220,Message,morbi a ipsum integer a nibh,579,true,2024-05-07 08:09:54
209,966,Message,odio in hac habitasse platea,276,true,2024-10-23 16:31:57
210,530,Message,tincidunt in leo maecenas pulvinar lobortis est phasellus sit amet erat nulla tempus,47,true,2024-10-15 00:51:03
211,442,Message,praesent blandit lacinia erat vestibulum sed magna at nunc commodo placerat praesent blandit nam nulla integer pede justo lacinia,505,true,2024-09-24 14:57:18
212,38,Message,eros vestibulum ac est lacinia nisi venenatis tristique fusce congue diam id ornare imperdiet sapien urna,693,true,2024-04-28 03:14:34
213,291,Message,lobortis est phasellus sit amet erat nulla tempus,951,false,2024-09-17 10:25:27
214,868,Message,nisl nunc nisl duis bibendum felis sed interdum venenatis turpis enim blandit mi in porttitor pede,225,true,2024-03-24 20:28:36
215,921,Message,pretium nisl ut volutpat sapien arcu sed augue aliquam erat,129,true,2024-02-12 21:02:47
216,78,Message,mattis nibh ligula nec sem duis,511,false,2024-02-02 17:56:27
217,452,Message,quam sollicitudin vitae consectetuer eget rutrum at lorem integer tincidunt ante vel ipsum,683,false,2024-11-14 18:00:26
218,87,Message,ante vel ipsum praesent blandit lacinia erat,497,true,2024-03-02 21:48:32
219,273,Message,in leo maecenas pulvinar lobortis,583,false,2024-09-14 03:56:50
220,752,Message,turpis sed ante vivamus tortor duis mattis egestas metus aenean,781,true,2024-09-14 13:04:52
221,715,Message,in hac habitasse platea dictumst maecenas ut massa quis augue luctus tincidunt nulla mollis molestie lorem,84,false,2024-09-26 05:10:40
222,740,Message,turpis nec euismod scelerisque quam turpis adipiscing lorem vitae mattis nibh,97,true,2024-04-01 19:04:41
223,741,Message,sit amet diam in magna bibendum imperdiet nullam orci pede,619,true,2024-10-08 06:07:55
224,756,Message,urna ut tellus nulla ut erat id mauris vulputate elementum nullam varius nulla facilisi cras,364,true,2024-04-01 21:44:08
225,225,Message,augue vestibulum rutrum rutrum neque aenean auctor gravida sem praesent id massa id nisl venenatis lacinia aenean sit amet justo,637,true,2024-05-31 12:21:06
226,848,Message,donec posuere metus vitae ipsum aliquam non mauris morbi non lectus aliquam sit amet diam in magna bibendum imperdiet nullam,202,true,2024-12-20 06:57:50
227,127,Message,nulla integer pede justo lacinia eget tincidunt,323,false,2024-11-30 13:12:29
228,334,Message,magnis dis parturient montes nascetur ridiculus mus etiam vel augue vestibulum rutrum rutrum neque,766,false,2024-02-27 14:28:39
229,913,Message,arcu adipiscing molestie hendrerit at vulputate vitae nisl aenean lectus pellentesque eget nunc donec quis,682,false,2024-01-17 14:56:01
230,13,Message,eget orci vehicula condimentum curabitur in libero ut massa volutpat convallis morbi odio odio elementum eu interdum eu tincidunt,428,false,2024-06-07 03:31:57
231,724,Message,sagittis sapien cum sociis natoque penatibus et magnis dis parturient montes nascetur ridiculus mus etiam vel augue vestibulum,452,false,2024-02-27 04:26:33
232,801,Message,eu sapien cursus vestibulum proin eu mi nulla ac enim in tempor turpis nec euismod scelerisque quam,907,false,2024-09-17 00:51:01
233,530,Message,quam pharetra magna ac consequat metus sapien ut nunc vestibulum ante ipsum primis in faucibus,726,true,2024-09-25 01:51:44
234,152,Message,libero quis orci nullam molestie nibh in lectus pellentesque at nulla suspendisse potenti cras in,356,false,2024-04-28 16:00:45
235,411,Message,morbi vel lectus in quam fringilla rhoncus mauris enim,835,false,2024-05-17 05:51:49
236,713,Message,cubilia curae mauris viverra diam vitae quam suspendisse potenti,65,false,2024-01-20 04:48:21
237,287,Message,diam in magna bibendum imperdiet nullam orci pede venenatis non sodales sed tincidunt,218,false,2024-03-24 00:05:55
238,565,Message,nulla elit ac nulla sed vel enim sit amet nunc viverra dapibus nulla suscipit ligula in lacus curabitur at ipsum,921,false,2024-11-19 18:29:31
239,13,Message,platea dictumst aliquam augue quam sollicitudin vitae consectetuer eget rutrum at lorem integer tincidunt ante vel ipsum,541,false,2024-04-10 11:36:04
240,743,Message,vel augue vestibulum ante ipsum primis in faucibus orci luctus et ultrices,556,true,2024-12-14 01:58:36
241,856,Message,interdum eu tincidunt in leo,52,false,2024-02-19 20:54:24
242,689,Message,hac habitasse platea dictumst maecenas ut massa quis augue luctus tincidunt nulla mollis molestie lorem quisque,124,true,2024-04-24 08:59:09
243,366,Message,ut nulla sed accumsan felis ut at dolor quis odio consequat varius integer ac leo pellentesque ultrices mattis odio,687,true,2024-08-08 21:01:35
244,600,Message,ut at dolor quis odio consequat varius integer ac,925,false,2024-07-04 15:59:01
245,792,Message,erat tortor sollicitudin mi sit amet lobortis sapien sapien non mi integer ac,837,true,2024-07-27 00:34:16
246,897,Message,pretium nisl ut volutpat sapien arcu sed augue aliquam erat volutpat in congue etiam justo etiam pretium iaculis justo,484,false,2024-02-08 04:03:56
247,271,Message,semper porta volutpat quam pede lobortis ligula sit amet eleifend pede libero quis,715,false,2024-10-21 06:08:11
248,256,Message,dictumst etiam faucibus cursus urna ut,682,false,2024-11-23 19:41:25
249,74,Message,in sapien iaculis congue vivamus metus arcu adipiscing molestie hendrerit at vulputate,968,false,2024-06-19 03:20:32
250,711,Message,libero quis orci nullam molestie nibh in lectus pellentesque,535,false,2024-12-26 04:43:21
251,842,Message,dictumst morbi vestibulum velit id pretium iaculis diam erat,650,false,2024-02-17 23:00:37
252,744,Message,sagittis sapien cum sociis natoque penatibus et magnis dis parturient montes,912,false,2024-02-19 14:05:58
253,884,Message,elit proin risus praesent lectus vestibulum quam sapien varius ut blandit non,94,false,2024-04-22 01:57:16
254,19,Message,est phasellus sit amet erat nulla tempus vivamus in felis eu,990,false,2024-06-22 14:38:39
255,517,Message,cubilia curae donec pharetra magna vestibulum aliquet ultrices erat tortor sollicitudin,186,false,2024-06-11 06:21:40
256,581,Message,sed nisl nunc rhoncus dui vel sem sed sagittis nam congue risus semper porta volutpat quam,14,false,2024-09-14 19:49:59
257,558,Message,a feugiat et eros vestibulum ac est lacinia nisi venenatis tristique fusce congue diam id ornare imperdiet sapien,317,true,2024-02-02 19:33:24
258,81,Message,elementum in hac habitasse platea dictumst morbi vestibulum velit id,484,false,2024-09-25 17:45:44
259,538,Message,in faucibus orci luctus et ultrices posuere cubilia curae nulla dapibus dolor vel est donec,449,false,2024-08-31 19:06:31
260,699,Message,condimentum curabitur in libero ut massa volutpat convallis morbi odio odio,385,true,2024-04-22 14:27:06
261,562,Message,nulla suspendisse potenti cras in purus eu magna vulputate,997,true,2024-07-17 14:12:08
262,842,Message,amet justo morbi ut odio cras mi pede malesuada in imperdiet et commodo vulputate justo in blandit ultrices enim lorem,421,false,2024-05-18 08:52:00
263,533,Message,aliquam non mauris morbi non lectus aliquam sit amet diam in magna bibendum imperdiet nullam orci pede venenatis,640,false,2024-05-28 21:08:29
264,940,Message,a pede posuere nonummy integer non,248,true,2024-08-19 21:39:52
265,586,Message,suspendisse accumsan tortor quis turpis sed ante vivamus tortor duis,412,true,2024-08-17 21:29:46
266,357,Message,neque vestibulum eget vulputate ut ultrices vel augue vestibulum ante ipsum primis,586,true,2024-02-26 11:29:15
267,795,Message,pretium iaculis justo in hac habitasse platea dictumst etiam faucibus cursus urna ut tellus nulla ut erat id,286,false,2024-10-08 19:32:35
268,177,Message,dolor quis odio consequat varius integer ac leo pellentesque ultrices,172,false,2024-10-09 14:43:16
269,275,Message,erat eros viverra eget congue eget semper rutrum nulla nunc purus phasellus in felis,734,false,2024-07-22 13:47:19
270,301,Message,in felis eu sapien cursus vestibulum,191,true,2024-03-15 05:14:23
271,565,Message,convallis nunc proin at turpis a pede posuere nonummy integer non velit donec diam neque vestibulum eget vulputate ut ultrices,646,true,2024-02-01 13:49:51
272,641,Message,morbi vel lectus in quam fringilla rhoncus mauris enim leo rhoncus sed vestibulum sit amet,633,true,2024-11-24 01:39:10
273,753,Message,pulvinar nulla pede ullamcorper augue a suscipit nulla elit ac nulla sed vel enim sit amet nunc viverra,989,false,2024-11-18 13:55:19
274,159,Message,quis orci eget orci vehicula condimentum curabitur in libero ut massa volutpat convallis morbi odio odio,616,false,2024-08-17 02:58:53
275,955,Message,posuere nonummy integer non velit donec diam neque vestibulum eget vulputate ut ultrices vel augue vestibulum ante ipsum primis,761,false,2024-05-13 16:17:19
276,649,Message,morbi ut odio cras mi pede malesuada in imperdiet et commodo vulputate justo in blandit ultrices enim lorem ipsum dolor,323,false,2024-01-15 03:13:02
277,718,Message,nulla nunc purus phasellus in felis donec semper,346,false,2024-08-12 13:02:33
278,467,Message,consequat nulla nisl nunc nisl duis bibendum felis sed interdum venenatis turpis enim,389,true,2024-02-18 17:05:35
279,818,Message,elementum pellentesque quisque porta volutpat erat quisque erat eros viverra eget congue eget semper,600,false,2024-11-30 18:12:39
280,420,Message,sed lacus morbi sem mauris laoreet ut rhoncus aliquet pulvinar sed nisl nunc rhoncus dui,916,true,2024-09-06 07:15:26
281,989,Message,non sodales sed tincidunt eu felis fusce posuere felis sed lacus morbi sem mauris laoreet ut rhoncus aliquet pulvinar,956,false,2024-01-08 14:47:07
282,125,Message,nonummy integer non velit donec diam neque vestibulum eget vulputate ut ultrices vel augue vestibulum,664,false,2024-07-12 05:06:03
283,132,Message,at turpis donec posuere metus vitae ipsum aliquam non mauris morbi non,921,true,2024-01-01 07:11:15
284,67,Message,orci eget orci vehicula condimentum curabitur in libero ut massa volutpat convallis morbi odio odio elementum eu interdum eu,319,true,2024-01-31 20:34:47
285,145,Message,non velit nec nisi vulputate nonummy maecenas tincidunt lacus at velit vivamus vel nulla eget,670,true,2024-09-01 23:34:55
286,960,Message,justo sollicitudin ut suscipit a feugiat et eros vestibulum ac est lacinia nisi venenatis tristique fusce congue diam id,292,true,2024-08-13 22:42:20
287,448,Message,ut erat curabitur gravida nisi at nibh in hac habitasse platea dictumst aliquam augue quam sollicitudin vitae consectetuer,361,false,2024-02-16 10:39:00
288,712,Message,eget semper rutrum nulla nunc purus phasellus in felis donec semper sapien a,745,true,2024-04-27 21:52:29
289,44,Message,morbi vel lectus in quam fringilla rhoncus mauris enim leo rhoncus sed vestibulum,191,false,2024-06-16 04:44:56
290,29,Message,nunc purus phasellus in felis donec semper sapien a libero nam,386,false,2024-03-30 14:39:13
291,730,Message,vel pede morbi porttitor lorem id ligula,419,true,2024-10-22 00:32:27
292,843,Message,ut erat id mauris vulputate elementum nullam varius nulla facilisi,528,true,2024-09-04 19:30:30
293,785,Message,vestibulum ac est lacinia nisi venenatis tristique,64,false,2024-05-18 10:14:38
294,497,Message,gravida nisi at nibh in hac,925,false,2024-01-17 18:49:34
295,189,Message,accumsan tortor quis turpis sed ante vivamus tortor duis mattis egestas metus aenean fermentum,206,false,2024-03-31 09:42:40
296,230,Message,vestibulum ante ipsum primis in faucibus orci luctus et ultrices posuere,443,false,2024-12-12 03:10:59
297,790,Message,etiam vel augue vestibulum rutrum rutrum neque aenean,253,false,2024-02-15 22:31:29
298,192,Message,congue eget semper rutrum nulla,864,true,2024-03-18 11:20:00
299,889,Message,nullam varius nulla facilisi cras non velit nec nisi vulputate nonummy maecenas tincidunt,930,false,2024-04-29 08:42:49
300,109,Message,justo maecenas rhoncus aliquam lacus morbi quis tortor id nulla ultrices aliquet maecenas leo odio condimentum id,713,true,2024-05-20 15:27:40
301,591,Message,eget massa tempor convallis nulla neque libero convallis eget eleifend luctus ultricies eu nibh,149,false,2024-05-20 01:39:41
302,637,Message,sapien placerat ante nulla justo aliquam quis turpis eget elit sodales scelerisque mauris sit,701,false,2024-04-20 00:52:59
303,408,Message,massa id lobortis convallis tortor risus dapibus augue vel accumsan tellus nisi eu orci mauris lacinia sapien quis,831,false,2024-11-14 10:00:33
304,49,Message,tristique est et tempus semper est quam pharetra magna ac consequat metus sapien ut nunc vestibulum ante ipsum primis in,222,false,2024-03-16 17:20:18
305,821,Message,aliquam quis turpis eget elit sodales scelerisque mauris sit amet eros suspendisse accumsan tortor quis turpis sed ante,25,true,2024-07-02 04:45:40
306,155,Message,neque sapien placerat ante nulla justo aliquam quis turpis eget elit sodales scelerisque,850,false,2024-02-27 12:51:11
307,943,Message,rhoncus aliquam lacus morbi quis tortor,559,true,2024-08-29 00:38:21
308,352,Message,felis fusce posuere felis sed lacus,110,true,2024-01-10 07:43:17
309,834,Message,nisl duis ac nibh fusce lacus purus aliquet at feugiat non pretium quis lectus,795,false,2024-11-12 12:03:11
310,110,Message,nascetur ridiculus mus etiam vel augue vestibulum rutrum rutrum neque aenean auctor gravida sem praesent,469,true,2024-07-03 23:25:27
311,957,Message,luctus et ultrices posuere cubilia curae duis faucibus accumsan odio,815,true,2024-10-10 23:20:38
312,759,Message,a feugiat et eros vestibulum ac,595,false,2024-10-20 21:33:03
313,852,Message,quisque erat eros viverra eget congue eget semper rutrum nulla nunc purus,368,false,2024-04-25 07:02:27
314,261,Message,donec dapibus duis at velit eu est congue elementum in hac habitasse platea dictumst morbi vestibulum velit id pretium iaculis,944,false,2024-08-16 14:16:54
315,887,Message,vestibulum sed magna at nunc,460,false,2024-03-27 01:52:08
316,358,Message,elementum in hac habitasse platea dictumst morbi vestibulum velit id pretium iaculis diam erat,849,true,2024-08-20 16:20:39
317,716,Message,vitae nisl aenean lectus pellentesque eget nunc donec quis orci eget orci vehicula condimentum,975,true,2024-05-10 12:36:52
318,186,Message,felis ut at dolor quis odio consequat varius integer ac leo pellentesque ultrices,112,false,2024-03-31 09:46:02
319,788,Message,vestibulum rutrum rutrum neque aenean auctor gravida,909,true,2024-03-08 19:09:09
320,751,Message,donec ut dolor morbi vel lectus in quam fringilla rhoncus,803,false,2024-05-05 09:10:40
321,174,Message,donec vitae nisi nam ultrices libero non mattis pulvinar nulla pede,857,false,2024-09-28 15:40:31
322,588,Message,tincidunt in leo maecenas pulvinar lobortis est phasellus sit amet,428,false,2024-11-18 17:30:15
323,347,Message,ornare imperdiet sapien urna pretium nisl ut,216,true,2024-11-20 16:43:45
324,727,Message,velit vivamus vel nulla eget eros elementum,522,false,2024-11-06 14:00:18
325,149,Message,amet nulla quisque arcu libero rutrum ac lobortis vel dapibus at diam nam tristique,43,false,2024-07-07 15:14:30
326,790,Message,nulla quisque arcu libero rutrum ac lobortis vel dapibus at diam nam tristique tortor eu,761,false,2024-07-11 01:47:32
327,143,Message,id nulla ultrices aliquet maecenas leo odio condimentum id luctus,962,false,2024-04-05 06:35:41
328,136,Message,adipiscing elit proin interdum mauris non ligula pellentesque ultrices phasellus id sapien in sapien iaculis congue vivamus metus arcu adipiscing,187,true,2024-04-01 02:59:27
329,835,Message,mauris laoreet ut rhoncus aliquet pulvinar sed nisl nunc rhoncus dui vel sem,51,true,2024-03-14 03:27:47
330,937,Message,nonummy integer non velit donec diam,663,false,2024-09-25 22:39:59
331,324,Message,tincidunt eget tempus vel pede morbi porttitor lorem id ligula suspendisse ornare consequat,264,true,2024-04-19 08:14:30
332,374,Message,fusce congue diam id ornare imperdiet,269,true,2024-05-03 04:50:08
333,503,Message,eget rutrum at lorem integer tincidunt ante vel ipsum praesent blandit lacinia erat vestibulum sed magna,722,false,2024-02-28 20:29:04
334,559,Message,et ultrices posuere cubilia curae donec pharetra magna,408,false,2024-01-10 05:59:06
335,704,Message,leo maecenas pulvinar lobortis est phasellus sit amet erat nulla tempus vivamus in,185,true,2024-06-16 22:29:11
336,315,Message,sem praesent id massa id nisl venenatis lacinia aenean sit amet justo morbi,487,false,2024-07-11 21:58:15
337,156,Message,lacus at velit vivamus vel nulla eget eros elementum pellentesque quisque porta volutpat erat quisque erat eros viverra eget,119,true,2024-05-28 06:40:11
338,600,Message,tempus sit amet sem fusce consequat nulla nisl,715,false,2024-07-09 07:52:16
339,442,Message,in sagittis dui vel nisl duis ac,803,false,2024-12-10 00:06:31
340,683,Message,ultrices libero non mattis pulvinar nulla pede ullamcorper augue a suscipit nulla elit ac nulla sed vel,27,true,2024-09-12 00:51:13
341,397,Message,convallis morbi odio odio elementum eu interdum eu tincidunt in leo maecenas pulvinar lobortis est phasellus sit amet,300,false,2024-11-05 08:26:34
342,927,Message,porttitor lorem id ligula suspendisse ornare consequat lectus in est risus auctor sed tristique in tempus sit amet sem fusce,824,true,2024-12-01 21:07:48
343,665,Message,habitasse platea dictumst aliquam augue quam sollicitudin vitae consectetuer eget rutrum,332,true,2024-06-24 09:57:58
344,488,Message,tellus semper interdum mauris ullamcorper purus sit amet nulla quisque arcu libero,455,true,2024-12-04 08:50:51
345,614,Message,fringilla rhoncus mauris enim leo rhoncus sed vestibulum sit amet cursus id turpis integer aliquet massa,741,false,2024-05-22 02:41:59
346,40,Message,duis ac nibh fusce lacus purus aliquet at feugiat non pretium quis lectus suspendisse potenti in eleifend quam,240,true,2024-08-06 00:23:20
347,877,Message,lectus in est risus auctor sed tristique in tempus sit amet sem fusce consequat nulla nisl nunc,488,true,2024-01-26 16:43:53
348,587,Message,in felis eu sapien cursus,169,false,2024-02-28 12:55:30
349,144,Message,felis sed lacus morbi sem mauris laoreet ut rhoncus aliquet pulvinar sed,83,true,2024-03-21 21:02:57
350,288,Message,pretium nisl ut volutpat sapien arcu sed augue aliquam erat volutpat in congue etiam justo,224,false,2024-02-16 22:59:18
351,683,Message,molestie hendrerit at vulputate vitae nisl aenean lectus pellentesque eget nunc donec quis orci eget,587,true,2024-12-14 17:43:54
352,138,Message,pellentesque volutpat dui maecenas tristique est et tempus semper est quam,875,true,2024-03-26 15:45:00
353,244,Message,lacinia nisi venenatis tristique fusce congue diam id ornare imperdiet sapien urna pretium nisl ut volutpat sapien,94,false,2024-12-04 13:46:36
354,818,Message,fusce congue diam id ornare imperdiet sapien urna pretium,224,true,2024-09-13 19:39:08
355,51,Message,justo in blandit ultrices enim lorem ipsum dolor sit amet consectetuer,750,true,2024-04-17 04:08:42
356,776,Message,sed sagittis nam congue risus semper porta volutpat quam pede lobortis ligula sit amet eleifend pede libero quis orci,688,true,2024-06-17 08:22:40
357,816,Message,malesuada in imperdiet et commodo vulputate,127,true,2024-01-29 14:28:58
358,514,Message,adipiscing elit proin risus praesent lectus vestibulum quam sapien varius ut blandit non interdum in ante vestibulum ante ipsum,200,false,2024-10-05 02:21:37
359,803,Message,purus aliquet at feugiat non pretium quis lectus suspendisse potenti in eleifend quam a odio in,570,true,2024-12-14 21:36:05
360,90,Message,ligula in lacus curabitur at ipsum ac tellus semper interdum mauris ullamcorper purus sit amet nulla,72,true,2024-09-19 17:10:15
361,990,Message,nulla eget eros elementum pellentesque quisque porta volutpat erat quisque erat eros viverra eget congue eget semper,665,true,2024-01-05 05:36:59
362,608,Message,mus etiam vel augue vestibulum rutrum rutrum neque aenean auctor gravida sem praesent id massa,765,false,2024-06-13 21:39:14
363,481,Message,volutpat in congue etiam justo etiam pretium iaculis justo in hac,816,true,2024-07-26 00:10:37
364,863,Message,in hac habitasse platea dictumst etiam,435,false,2024-08-01 20:50:19
365,884,Message,mattis pulvinar nulla pede ullamcorper augue a suscipit nulla elit ac nulla sed vel enim sit amet,676,true,2024-05-07 13:05:15
366,128,Message,lacus curabitur at ipsum ac tellus semper interdum mauris ullamcorper purus sit amet nulla quisque,32,true,2024-04-29 12:53:20
367,153,Message,habitasse platea dictumst morbi vestibulum velit id pretium iaculis,48,false,2024-05-06 22:10:20
368,137,Message,aliquet pulvinar sed nisl nunc rhoncus dui vel sem sed sagittis nam congue risus semper porta,763,true,2024-05-01 23:17:39
369,740,Message,in tempus sit amet sem fusce consequat nulla nisl nunc nisl duis bibendum felis sed,694,true,2024-06-13 03:42:29
370,49,Message,erat nulla tempus vivamus in felis eu sapien,665,true,2024-03-24 01:50:36
371,736,Message,dui nec nisi volutpat eleifend donec ut dolor morbi,154,false,2024-02-27 15:20:59
372,734,Message,id luctus nec molestie sed justo pellentesque viverra,188,true,2024-03-03 21:49:07
373,973,Message,eu magna vulputate luctus cum,112,false,2024-11-25 20:59:43
374,628,Message,at lorem integer tincidunt ante vel ipsum praesent blandit lacinia erat vestibulum sed magna at,35,true,2024-11-04 05:42:32
375,711,Message,aliquet at feugiat non pretium quis,34,true,2024-05-09 16:32:35
376,45,Message,sit amet sem fusce consequat nulla nisl,458,true,2024-11-08 04:00:25
377,932,Message,pellentesque volutpat dui maecenas tristique est et tempus semper est quam pharetra magna ac consequat,893,true,2024-01-27 03:21:30
378,152,Message,et ultrices posuere cubilia curae mauris viverra diam vitae quam suspendisse potenti,432,false,2024-12-06 22:58:29
379,927,Message,faucibus cursus urna ut tellus,737,false,2024-03-02 00:54:04
380,110,Message,ac enim in tempor turpis nec euismod scelerisque quam turpis adipiscing lorem vitae mattis nibh,138,true,2024-11-07 11:45:29
381,967,Message,purus phasellus in felis donec semper sapien a libero nam dui proin leo odio porttitor id,86,false,2024-10-07 06:31:23
382,888,Message,ipsum primis in faucibus orci luctus et ultrices posuere cubilia curae donec pharetra magna vestibulum aliquet ultrices,75,true,2024-01-05 06:10:07
383,327,Message,viverra dapibus nulla suscipit ligula in lacus curabitur at ipsum ac tellus semper interdum mauris ullamcorper purus sit,155,false,2024-02-13 15:45:41
384,810,Message,at vulputate vitae nisl aenean lectus pellentesque eget nunc donec,113,false,2024-08-20 04:18:24
385,454,Message,pede ac diam cras pellentesque volutpat dui maecenas tristique est et tempus semper est quam pharetra,680,false,2024-11-08 17:55:21
386,907,Message,consectetuer adipiscing elit proin interdum mauris non ligula pellentesque ultrices phasellus id sapien in sapien iaculis congue vivamus,519,true,2024-11-08 08:37:49
387,503,Message,rutrum at lorem integer tincidunt ante vel ipsum praesent blandit lacinia erat vestibulum sed magna at nunc,512,false,2024-02-24 14:35:26
388,311,Message,id nisl venenatis lacinia aenean sit amet justo morbi ut odio cras mi pede malesuada,132,true,2024-11-09 14:29:15
389,70,Message,eget nunc donec quis orci eget orci vehicula condimentum curabitur in libero ut massa volutpat convallis morbi odio,875,true,2024-09-07 18:53:10
390,599,Message,donec quis orci eget orci vehicula condimentum curabitur,212,false,2024-12-04 15:59:04
391,982,Message,in lectus pellentesque at nulla suspendisse potenti cras in purus eu magna vulputate,651,false,2024-07-08 01:23:51
392,344,Message,suspendisse accumsan tortor quis turpis,356,false,2024-08-19 10:01:02
393,414,Message,orci pede venenatis non sodales sed tincidunt eu felis fusce posuere felis sed lacus,235,false,2024-08-30 01:14:28
394,509,Message,vulputate vitae nisl aenean lectus pellentesque eget nunc donec quis orci eget,206,true,2024-02-09 18:57:33
395,933,Message,tellus nulla ut erat id mauris vulputate elementum nullam varius nulla facilisi cras non,508,false,2024-05-06 13:22:21
396,801,Message,porttitor lacus at turpis donec posuere metus vitae ipsum aliquam,837,true,2024-01-17 01:41:22
397,161,Message,amet lobortis sapien sapien non mi integer ac neque duis bibendum morbi non quam nec dui luctus,676,true,2024-06-19 18:15:24
398,551,Message,convallis tortor risus dapibus augue vel accumsan tellus nisi eu orci,606,true,2024-10-03 19:13:36
399,724,Message,sit amet nulla quisque arcu libero,75,true,2024-10-31 15:12:02
400,249,Message,auctor gravida sem praesent id massa id nisl venenatis lacinia aenean sit amet,635,true,2024-05-03 09:06:14
401,562,Message,ultrices aliquet maecenas leo odio condimentum id luctus nec molestie sed justo pellentesque viverra pede,65,true,2024-01-30 13:50:29
402,215,Message,ut erat curabitur gravida nisi at,137,true,2024-06-10 02:22:36
403,801,Message,in tempor turpis nec euismod scelerisque quam turpis adipiscing lorem vitae mattis nibh ligula nec sem,817,false,2024-02-01 13:38:20
404,916,Message,dis parturient montes nascetur ridiculus mus etiam,42,false,2024-04-17 01:29:20
405,567,Message,mauris viverra diam vitae quam suspendisse potenti nullam porttitor lacus at turpis donec posuere metus vitae ipsum aliquam non mauris,921,false,2024-12-15 09:28:14
406,812,Message,suscipit nulla elit ac nulla sed vel enim sit amet,916,false,2024-11-28 00:51:51
407,562,Message,eu massa donec dapibus duis at velit eu est congue elementum in hac habitasse platea,810,false,2024-12-23 08:53:13
408,409,Message,arcu libero rutrum ac lobortis vel dapibus at diam nam,887,true,2024-10-11 10:49:24
409,597,Message,euismod scelerisque quam turpis adipiscing,830,true,2024-03-08 05:11:45
410,193,Message,nisi at nibh in hac habitasse platea dictumst aliquam augue quam sollicitudin vitae,542,false,2024-12-12 16:16:50
