PostID,UserID,PostType,Content,RecipientID,Visible,CreationTime
620,843,Message,congue elementum in hac habitasse platea dictumst morbi vestibulum velit id pretium iaculis diam erat fermentum justo nec condimentum,524,false,2024-08-01 05:50:53
621,886,Message,in hac habitasse platea dictumst maecenas ut massa quis augue,612,false,2024-01-08 19:29:53
622,115,Message,rutrum at lorem integer tincidunt,684,false,2024-09-13 23:51:52
623,609,Message,rutrum at lorem integer tincidunt ante vel ipsum praesent blandit lacinia erat vestibulum sed magna at,828,true,2024-02-03 01:24:52
624,107,Message,felis ut at dolor quis odio consequat varius integer ac leo pellentesque ultrices,70,false,2024-02-03 13:08:18
625,568,Message,in faucibus orci luctus et ultrices posuere cubilia curae nulla dapibus,186,true,2024-12-06 13:59:32
626,757,Message,consequat in consequat ut nulla sed accumsan felis ut at dolor quis,6,false,2024-12-09 18:46:55
627,767,Message,enim lorem ipsum dolor sit amet consectetuer adipiscing elit proin interdum mauris non ligula pellentesque ultrices phasellus id,82,true,2024-05-13 07:23:34
628,572,Message,nunc rhoncus dui vel sem sed sagittis nam congue risus semper porta volutpat quam pede lobortis ligula sit,192,true,2024-05-08 18:48:59
629,284,Message,pede malesuada in imperdiet et commodo vulputate justo in,583,true,2024-05-22 23:49:11
630,502,Message,curae duis faucibus accumsan odio curabitur,150,false,2024-06-22 10:47:20
631,207,Message,sed nisl nunc rhoncus dui vel sem sed sagittis nam congue,715,false,2024-08-04 03:19:41
632,113,Message,rutrum rutrum neque aenean auctor gravida sem praesent id massa id nisl venenatis lacinia aenean,870,true,2024-01-31 10:26:44
633,879,Message,cursus vestibulum proin eu mi nulla ac enim in tempor turpis nec euismod scelerisque,698,false,2024-06-28 01:56:24
634,562,Message,bibendum morbi non quam nec dui luctus rutrum nulla tellus in sagittis dui vel nisl duis ac,494,false,2024-05-16 00:51:47
635,887,Message,etiam faucibus cursus urna ut tellus nulla ut erat id mauris vulputate elementum nullam varius nulla facilisi,957,false,2024-09-25 08:27:01
636,726,Message,diam vitae quam suspendisse potenti nullam porttitor lacus at turpis donec,315,false,2024-12-26 04:39:01
637,157,Message,varius ut blandit non interdum in ante vestibulum ante ipsum primis in faucibus orci luctus et ultrices posuere cubilia,274,false,2024-03-24 02:53:23
638,579,Message,ipsum primis in faucibus orci luctus et,511,false,2024-10-29 01:04:42
639,974,Message,justo aliquam quis turpis eget elit sodales scelerisque mauris sit,430,true,2024-05-13 19:08:36
640,568,Message,sapien placerat ante nulla justo,978,true,2024-05-24 02:48:44
641,765,Message,aliquam augue quam sollicitudin vitae consectetuer eget rutrum at lorem integer tincidunt ante vel ipsum praesent blandit lacinia,116,false,2024-11-13 22:57:53
642,890,Message,lobortis convallis tortor risus dapibus augue vel accumsan tellus nisi,805,true,2024-04-08 08:34:31
643,110,Message,diam neque vestibulum eget vulputate ut ultrices vel augue vestibulum ante ipsum primis in faucibus orci luctus et ultrices,642,false,2024-10-24 08:50:45
644,228,Message,porttitor pede justo eu massa donec dapibus duis at velit eu,483,false,2024-02-03 05:31:33
645,236,Message,id justo sit amet sapien dignissim vestibulum vestibulum ante ipsum,330,true,2024-08-10 01:17:56
646,948,Message,aliquam convallis nunc proin at turpis a pede posuere nonummy,717,true,2024-09-06 14:46:01
647,848,Message,odio donec vitae nisi nam ultrices libero non mattis pulvinar nulla pede ullamcorper augue a suscipit nulla elit ac nulla,334,false,2024-01-30 10:32:50
648,570,Message,quis odio consequat varius integer ac leo pellentesque ultrices,103,true,2024-12-12 05:36:51
649,941,Message,at ipsum ac tellus semper interdum mauris ullamcorper purus sit amet nulla quisque arcu libero rutrum ac lobortis,627,true,2024-11-26 18:54:51
650,802,Message,nec sem duis aliquam convallis nunc proin at turpis a pede posuere nonummy integer non velit donec,192,true,2024-01-23 21:58:29
651,179,Message,pede venenatis non sodales sed tincidunt eu felis fusce posuere felis sed lacus morbi sem mauris laoreet ut rhoncus aliquet,299,true,2024-04-20 23:18:07
652,715,Message,curabitur at ipsum ac tellus semper interdum mauris ullamcorper purus sit amet,381,false,2024-01-18 22:53:29
653,91,Message,cubilia curae nulla dapibus dolor vel est donec odio,48,false,2024-03-20 17:55:33
654,913,Message,id nisl venenatis lacinia aenean sit amet justo morbi ut odio cras mi pede malesuada in imperdiet,968,false,2024-10-12 10:38:11
655,659,Message,amet diam in magna bibendum imperdiet nullam orci pede venenatis non sodales sed tincidunt eu,738,true,2024-09-24 23:40:54
656,298,Message,duis bibendum felis sed interdum venenatis turpis enim blandit mi in porttitor pede justo,888,false,2024-09-14 18:35:12
657,637,Message,vehicula consequat morbi a ipsum integer a nibh in quis justo maecenas rhoncus aliquam,603,false,2024-09-18 07:21:30
658,949,Message,non interdum in ante vestibulum ante ipsum primis in faucibus orci luctus et ultrices posuere cubilia curae,418,true,2024-09-09 19:02:05
659,256,Message,fermentum justo nec condimentum neque sapien placerat ante nulla justo,519,true,2024-11-18 21:00:25
660,123,Message,nulla suspendisse potenti cras in purus eu magna,564,true,2024-07-02 22:59:40
661,676,Message,proin eu mi nulla ac enim in tempor turpis nec euismod scelerisque quam turpis adipiscing lorem vitae,596,false,2024-10-22 22:04:06
662,628,Message,suspendisse accumsan tortor quis turpis sed ante vivamus tortor duis mattis egestas,690,true,2024-06-24 04:17:44
663,813,Message,odio donec vitae nisi nam ultrices libero non mattis pulvinar nulla pede ullamcorper augue,513,true,2024-10-26 17:32:55
664,809,Message,aliquam convallis nunc proin at turpis a pede posuere nonummy integer non velit,251,true,2024-02-12 04:26:17
665,836,Message,orci mauris lacinia sapien quis libero nullam sit amet turpis elementum ligula vehicula consequat morbi a ipsum,622,false,2024-12-04 00:59:49
666,405,Message,integer a nibh in quis justo maecenas rhoncus aliquam lacus morbi,106,false,2024-12-09 12:23:16
667,752,Message,accumsan tellus nisi eu orci mauris lacinia sapien,310,true,2024-03-27 09:37:41
668,235,Message,arcu adipiscing molestie hendrerit at vulputate,847,false,2024-03-09 01:42:56
669,769,Message,quam a odio in hac habitasse platea dictumst maecenas ut massa quis augue luctus tincidunt nulla mollis molestie,993,false,2024-04-22 00:38:36
670,977,Message,etiam justo etiam pretium iaculis justo in hac habitasse platea dictumst etiam faucibus cursus,369,false,2024-11-20 22:27:17
671,563,Message,eget tempus vel pede morbi porttitor lorem id ligula suspendisse ornare consequat lectus in est risus auctor sed tristique,311,false,2024-09-12 20:26:04
672,191,Message,vel pede morbi porttitor lorem id ligula suspendisse ornare consequat lectus in est,203,false,2024-08-28 01:57:21
673,860,Message,fermentum donec ut mauris eget massa tempor convallis nulla neque,876,true,2024-08-03 15:29:57
674,23,Message,in faucibus orci luctus et ultrices,679,false,2024-08-01 22:34:11
675,603,Message,convallis eget eleifend luctus ultricies eu nibh quisque id justo sit amet sapien dignissim,194,true,2024-11-21 05:00:46
676,753,Message,vestibulum aliquet ultrices erat tortor sollicitudin mi sit amet lobortis sapien,15,false,2024-10-08 03:34:00
677,115,Message,bibendum morbi non quam nec dui luctus rutrum nulla tellus in sagittis dui vel nisl duis ac,420,true,2024-02-03 05:38:59
678,28,Message,vestibulum sagittis sapien cum sociis natoque penatibus et magnis dis parturient montes nascetur ridiculus mus etiam vel augue vestibulum,392,false,2024-03-27 08:16:11
679,1000,Message,semper porta volutpat quam pede lobortis ligula sit amet eleifend pede libero,475,false,2024-02-17 01:33:25
680,252,Message,ipsum dolor sit amet consectetuer adipiscing elit proin interdum mauris non ligula pellentesque ultrices phasellus id sapien in sapien,978,false,2024-03-24 13:49:11
681,959,Message,et magnis dis parturient montes nascetur ridiculus mus vivamus vestibulum sagittis sapien cum sociis natoque penatibus et magnis,56,true,2024-06-04 18:37:17
682,534,Message,vestibulum sagittis sapien cum sociis natoque penatibus et magnis dis parturient montes nascetur ridiculus mus etiam vel augue,701,true,2024-06-07 14:35:12
683,912,Message,donec vitae nisi nam ultrices libero non mattis pulvinar nulla pede ullamcorper augue a suscipit nulla elit ac nulla sed,364,false,2024-07-23 19:12:49
684,764,Message,morbi quis tortor id nulla ultrices aliquet maecenas leo odio condimentum id luctus nec,224,false,2024-03-03 09:00:00
685,188,Message,rhoncus sed vestibulum sit amet cursus id turpis integer aliquet massa id lobortis convallis tortor risus dapibus,365,true,2024-03-24 15:52:23
686,122,Message,eu mi nulla ac enim in tempor turpis nec euismod scelerisque quam turpis adipiscing lorem vitae mattis,39,true,2024-09-11 07:04:05
687,106,Message,at nibh in hac habitasse platea dictumst aliquam augue quam sollicitudin vitae consectetuer eget rutrum at lorem integer tincidunt ante,186,true,2024-02-15 00:13:48
688,206,Message,natoque penatibus et magnis dis parturient montes nascetur ridiculus mus etiam vel augue vestibulum rutrum rutrum,716,false,2024-03-20 14:48:26
689,690,Message,sit amet turpis elementum ligula vehicula consequat morbi a ipsum integer a nibh,439,true,2024-04-09 16:53:42
690,586,Message,sit amet consectetuer adipiscing elit proin risus praesent lectus vestibulum quam sapien varius ut blandit non,425,true,2024-07-08 15:47:54
691,332,Message,ante vivamus tortor duis mattis egestas metus aenean fermentum donec ut mauris eget massa tempor convallis,241,false,2024-11-27 18:39:55
692,146,Message,sapien ut nunc vestibulum ante ipsum primis in faucibus orci luctus et ultrices posuere cubilia,451,true,2024-07-31 20:12:39
693,119,Message,habitasse platea dictumst maecenas ut massa quis augue luctus tincidunt nulla mollis molestie lorem quisque ut,758,true,2024-11-29 10:46:08
694,573,Message,tempus vel pede morbi porttitor lorem id ligula suspendisse,470,false,2024-11-04 18:25:29
695,139,Message,integer ac neque duis bibendum morbi,14,true,2024-09-01 08:16:39
696,993,Message,posuere nonummy integer non velit donec diam neque vestibulum eget,883,true,2024-09-07 14:54:32
697,635,Message,odio cras mi pede malesuada in imperdiet et,65,true,2024-05-19 19:42:28
698,454,Message,eu felis fusce posuere felis sed lacus morbi sem mauris laoreet ut rhoncus aliquet pulvinar sed,374,true,2024-03-09 01:15:39
699,456,Message,pede ullamcorper augue a suscipit nulla elit ac nulla sed vel enim sit amet nunc viverra dapibus,848,true,2024-09-21 02:42:17
700,876,Message,euismod scelerisque quam turpis adipiscing lorem vitae mattis nibh ligula nec sem duis aliquam convallis,837,false,2024-04-10 04:12:38
701,581,Message,sit amet consectetuer adipiscing elit proin interdum mauris non ligula pellentesque ultrices phasellus id sapien in sapien iaculis,275,false,2024-02-19 14:41:40
702,885,Message,tincidunt eu felis fusce posuere felis sed,814,false,2024-05-21 19:57:45
703,630,Message,justo sit amet sapien dignissim vestibulum vestibulum ante ipsum primis in faucibus orci luctus et ultrices posuere cubilia curae,776,false,2024-10-11 13:57:45
704,572,Message,nunc viverra dapibus nulla suscipit ligula in lacus curabitur at ipsum ac tellus semper interdum mauris ullamcorper,428,true,2024-01-05 11:04:40
705,722,Message,elit sodales scelerisque mauris sit amet eros suspendisse accumsan tortor quis turpis sed ante vivamus tortor duis,372,true,2024-12-15 19:24:37
706,757,Message,vulputate elementum nullam varius nulla facilisi cras non velit nec nisi vulputate nonummy maecenas tincidunt lacus at velit,911,false,2024-05-12 23:39:14
707,273,Message,morbi sem mauris laoreet ut rhoncus aliquet pulvinar sed nisl nunc rhoncus dui,572,true,2024-04-21 20:16:02
708,820,Message,in eleifend quam a odio in hac habitasse platea dictumst maecenas ut massa quis augue luctus tincidunt nulla,392,false,2024-09-02 06:01:58
709,41,Message,pede libero quis orci nullam molestie nibh in lectus pellentesque at nulla suspendisse potenti cras in,385,false,2024-09-03 15:51:43
710,987,Message,enim blandit mi in porttitor pede,445,true,2024-11-26 06:49:47
711,495,Message,dis parturient montes nascetur ridiculus mus vivamus vestibulum sagittis sapien cum sociis natoque,324,false,2024-07-31 03:21:38
712,671,Message,sed justo pellentesque viverra pede ac,197,true,2024-08-01 23:18:10
713,518,Message,fusce lacus purus aliquet at feugiat non pretium quis lectus suspendisse,561,true,2024-06-08 09:29:10
714,454,Message,fermentum justo nec condimentum neque sapien placerat,46,false,2024-05-13 23:33:13
715,301,Message,leo rhoncus sed vestibulum sit amet cursus id turpis integer aliquet massa id,686,false,2024-04-16 02:39:28
716,302,Message,amet diam in magna bibendum imperdiet nullam orci pede,991,false,2024-09-27 20:40:54
717,928,Message,quam pharetra magna ac consequat metus sapien ut nunc vestibulum ante ipsum primis in faucibus orci luctus,284,true,2024-02-02 10:58:20
718,124,Message,convallis eget eleifend luctus ultricies eu nibh quisque id justo sit amet,902,false,2024-11-17 07:41:57
719,661,Message,quis turpis sed ante vivamus tortor duis mattis egestas metus,660,false,2024-10-15 14:12:50
720,753,Message,justo sit amet sapien dignissim vestibulum vestibulum ante ipsum,187,true,2024-07-21 12:16:42
721,466,Message,amet sem fusce consequat nulla nisl nunc nisl duis bibendum felis sed interdum venenatis turpis enim,938,true,2024-06-01 02:05:05
722,573,Message,non quam nec dui luctus rutrum nulla tellus in sagittis dui vel nisl duis ac nibh,646,false,2024-09-18 19:57:19
723,551,Message,sollicitudin ut suscipit a feugiat et eros vestibulum ac est lacinia nisi venenatis,313,true,2024-03-18 10:45:09
724,45,Message,nulla dapibus dolor vel est donec odio justo sollicitudin ut,676,false,2024-01-16 20:01:02
725,621,Message,pede lobortis ligula sit amet eleifend pede libero quis orci,779,false,2024-11-11 20:44:57
726,404,Message,tincidunt ante vel ipsum praesent blandit lacinia erat vestibulum sed,547,false,2024-07-07 02:19:46
727,772,Message,ligula vehicula consequat morbi a ipsum integer a,26,false,2024-05-19 09:13:33
728,308,Message,orci luctus et ultrices posuere cubilia curae duis faucibus accumsan odio curabitur,787,true,2024-02-11 11:26:57
729,792,Message,etiam faucibus cursus urna ut tellus,874,true,2024-01-16 13:49:53
730,965,Message,adipiscing lorem vitae mattis nibh ligula nec sem duis,26,true,2024-02-15 06:52:47
731,205,Message,in ante vestibulum ante ipsum primis in faucibus orci luctus et ultrices posuere,922,false,2024-09-28 04:40:04
732,255,Message,justo aliquam quis turpis eget elit sodales scelerisque,366,true,2024-09-16 20:18:28
733,276,Message,pharetra magna ac consequat metus sapien ut nunc vestibulum ante ipsum primis in faucibus,582,false,2024-03-19 09:52:55
734,231,Message,convallis nulla neque libero convallis eget eleifend luctus ultricies eu nibh quisque id justo sit amet sapien dignissim vestibulum vestibulum,410,false,2024-10-11 08:35:23
735,627,Message,non velit donec diam neque vestibulum eget vulputate ut ultrices vel augue vestibulum,98,true,2024-01-02 07:46:36
736,787,Message,dui vel nisl duis ac nibh fusce lacus purus aliquet at feugiat,915,true,2024-07-12 04:19:06
737,113,Message,vulputate nonummy maecenas tincidunt lacus at velit vivamus vel nulla eget,385,true,2024-11-21 13:58:17
738,511,Message,libero rutrum ac lobortis vel dapibus at diam,747,false,2024-01-08 19:16:28
739,143,Message,primis in faucibus orci luctus,367,true,2024-02-09 18:03:22
740,466,Message,vestibulum ante ipsum primis in faucibus orci luctus et ultrices posuere cubilia curae nulla dapibus dolor vel est,499,false,2024-01-08 05:13:01
741,324,Message,vestibulum sit amet cursus id turpis integer aliquet massa id lobortis convallis tortor risus dapibus augue vel accumsan tellus,27,false,2024-10-30 23:39:14
742,193,Message,velit nec nisi vulputate nonummy maecenas tincidunt lacus at velit vivamus vel nulla eget eros elementum pellentesque quisque,629,false,2024-05-21 00:50:29
743,338,Message,mi in porttitor pede justo eu massa donec dapibus duis at velit eu est congue elementum in hac habitasse,328,true,2024-06-07 19:31:50
744,822,Message,orci luctus et ultrices posuere cubilia curae duis faucibus accumsan odio curabitur convallis duis consequat dui nec nisi,875,false,2024-02-11 12:28:25
745,280,Message,quis libero nullam sit amet turpis elementum ligula vehicula consequat morbi a,424,false,2024-04-03 17:17:10
746,770,Message,morbi sem mauris laoreet ut rhoncus aliquet pulvinar sed nisl nunc rhoncus dui vel sem sed sagittis nam congue risus,972,true,2024-05-29 14:12:17
747,825,Message,posuere metus vitae ipsum aliquam non,895,true,2024-04-21 11:31:33
748,670,Message,pede lobortis ligula sit amet eleifend pede libero quis orci nullam molestie nibh in lectus pellentesque at,627,true,2024-07-23 23:33:11
749,298,Message,integer ac leo pellentesque ultrices mattis odio donec vitae nisi nam ultrices libero non mattis,251,false,2024-03-20 04:06:20
750,455,Message,ac nibh fusce lacus purus aliquet at feugiat non pretium quis lectus suspendisse potenti in,475,false,2024-07-15 08:17:35
751,808,Message,tincidunt ante vel ipsum praesent blandit lacinia erat vestibulum sed magna at nunc,799,true,2024-12-29 01:30:48
752,639,Message,consequat metus sapien ut nunc vestibulum ante ipsum primis in faucibus orci luctus et ultrices posuere cubilia,224,false,2024-01-18 12:16:24
753,882,Message,amet consectetuer adipiscing elit proin interdum mauris non ligula pellentesque ultrices phasellus id,730,true,2024-02-19 16:39:16
754,816,Message,eget tempus vel pede morbi porttitor lorem id ligula suspendisse ornare consequat lectus in est risus,888,false,2024-09-06 17:37:14
755,818,Message,a ipsum integer a nibh in quis justo maecenas rhoncus aliquam,620,true,2024-09-28 02:17:49
756,451,Message,suscipit nulla elit ac nulla sed vel enim sit amet,202,true,2024-05-26 10:34:32
757,450,Message,nulla suscipit ligula in lacus curabitur at ipsum ac tellus semper interdum mauris ullamcorper purus sit amet nulla quisque,69,false,2024-09-23 19:34:40
758,339,Message,proin risus praesent lectus vestibulum,395,false,2024-12-16 20:45:38
759,265,Message,consequat metus sapien ut nunc vestibulum ante,927,true,2024-02-09 11:21:25
760,367,Message,sem fusce consequat nulla nisl nunc nisl duis,707,false,2024-01-10 10:36:46
761,47,Message,lacus morbi sem mauris laoreet,204,true,2024-03-25 13:57:27
762,840,Message,rhoncus sed vestibulum sit amet,652,true,2024-03-23 20:09:55
763,108,Message,vel enim sit amet nunc viverra dapibus nulla suscipit ligula in lacus curabitur at ipsum ac tellus semper interdum,322,false,2024-12-30 20:12:14
764,53,Message,luctus rutrum nulla tellus in sagittis,347,true,2024-04-20 23:21:57
765,500,Message,massa id nisl venenatis lacinia aenean sit amet justo morbi ut,575,true,2024-04-30 22:14:18
766,367,Message,aenean fermentum donec ut mauris eget massa tempor convallis nulla neque libero convallis,20,true,2024-09-30 19:43:19
767,228,Message,rhoncus dui vel sem sed sagittis nam congue risus semper porta volutpat quam pede lobortis ligula sit amet eleifend pede,288,false,2024-05-01 20:19:23
768,428,Message,tincidunt eget tempus vel pede morbi porttitor lorem id ligula suspendisse ornare consequat lectus in est risus auctor,700,true,2024-03-19 14:42:32
769,60,Message,vitae nisl aenean lectus pellentesque eget nunc donec quis orci eget orci vehicula condimentum curabitur in,558,false,2024-01-21 08:47:43
770,802,Message,vulputate luctus cum sociis natoque penatibus et magnis dis parturient montes nascetur ridiculus mus vivamus vestibulum,666,true,2024-10-07 02:34:05
771,646,Message,augue quam sollicitudin vitae consectetuer eget rutrum at lorem integer tincidunt ante vel ipsum praesent blandit lacinia erat vestibulum,518,true,2024-05-03 04:24:25
772,253,Message,gravida sem praesent id massa id nisl venenatis lacinia aenean sit amet justo morbi ut odio cras,509,false,2024-09-17 22:29:52
773,408,Message,at turpis donec posuere metus vitae ipsum,684,false,2024-07-27 17:38:09
774,264,Message,orci mauris lacinia sapien quis libero nullam sit,906,true,2024-06-23 18:28:25
775,550,Message,fusce consequat nulla nisl nunc nisl duis bibendum felis sed interdum venenatis turpis enim,222,true,2024-02-28 04:06:40
776,146,Message,accumsan felis ut at dolor quis odio consequat varius,272,false,2024-02-08 22:14:10
777,434,Message,lectus vestibulum quam sapien varius ut blandit non interdum in ante vestibulum ante ipsum primis,147,false,2024-02-22 11:03:24
778,777,Message,lacinia eget tincidunt eget tempus,484,true,2024-02-13 00:19:47
779,370,Message,ultrices erat tortor sollicitudin mi sit amet lobortis sapien,832,false,2024-04-20 04:08:32
780,649,Message,praesent blandit nam nulla integer pede justo,272,false,2024-10-25 22:08:01
781,371,Message,convallis morbi odio odio elementum eu interdum eu tincidunt,643,false,2024-03-06 23:45:15
782,734,Message,fermentum donec ut mauris eget massa tempor convallis nulla neque libero convallis eget,86,true,2024-02-03 02:31:10
783,700,Message,fusce congue diam id ornare imperdiet sapien urna pretium nisl ut volutpat sapien,218,true,2024-02-23 01:08:42
784,516,Message,vulputate ut ultrices vel augue vestibulum,883,true,2024-07-15 23:58:04
785,550,Message,nibh fusce lacus purus aliquet at feugiat non pretium quis lectus suspendisse potenti in eleifend quam,326,false,2024-10-14 02:24:42
786,977,Message,nam congue risus semper porta volutpat quam,159,true,2024-05-13 04:21:09
787,307,Message,neque vestibulum eget vulputate ut ultrices vel augue vestibulum ante ipsum primis in,986,true,2024-09-01 19:29:34
788,658,Message,primis in faucibus orci luctus,384,true,2024-04-07 04:17:47
789,870,Message,montes nascetur ridiculus mus vivamus vestibulum sagittis sapien cum sociis,658,false,2024-01-02 02:55:48
790,455,Message,elit sodales scelerisque mauris sit amet eros suspendisse accumsan tortor quis turpis sed ante vivamus tortor duis mattis egestas,59,false,2024-09-28 07:03:17
791,685,Message,rutrum rutrum neque aenean auctor gravida sem praesent id,427,true,2024-06-14 12:52:09
792,580,Message,dapibus duis at velit eu est congue elementum,900,true,2024-04-30 20:42:06
793,99,Message,nunc donec quis orci eget,361,true,2024-10-23 13:32:08
794,386,Message,sit amet nulla quisque arcu libero rutrum ac lobortis vel dapibus at diam nam tristique,932,true,2024-02-27 03:56:31
795,705,Message,convallis nunc proin at turpis a pede posuere,640,true,2024-10-13 22:20:10
796,728,Message,fermentum justo nec condimentum neque sapien placerat ante nulla justo aliquam quis,877,false,2024-03-17 15:01:12
797,764,Message,praesent blandit lacinia erat vestibulum sed magna at nunc commodo placerat praesent blandit nam nulla,543,true,2024-08-12 03:08:52
798,873,Message,id nulla ultrices aliquet maecenas leo odio condimentum id luctus nec molestie sed justo,192,true,2024-11-07 20:33:42
799,347,Message,maecenas leo odio condimentum id luctus nec molestie sed justo pellentesque viverra pede ac diam cras pellentesque volutpat dui,479,true,2024-12-25 21:13:25
800,522,Message,dictumst morbi vestibulum velit id pretium iaculis diam erat fermentum justo nec condimentum neque sapien placerat ante,284,false,2024-06-20 07:21:59
801,123,Message,ultrices posuere cubilia curae duis faucibus accumsan,915,false,2024-05-05 10:36:57
802,250,Message,ut at dolor quis odio consequat varius integer ac leo pellentesque ultrices mattis odio donec vitae,469,false,2024-10-24 22:40:13
803,242,Message,quis justo maecenas rhoncus aliquam lacus morbi quis tortor id nulla ultrices aliquet maecenas leo odio condimentum,271,true,2024-09-03 04:00:11
804,177,Message,erat eros viverra eget congue eget semper rutrum nulla nunc purus phasellus in,511,false,2024-09-17 23:39:20
805,145,Message,proin leo odio porttitor id consequat in consequat ut nulla sed accumsan,572,false,2024-10-22 08:03:21
806,795,Message,lobortis ligula sit amet eleifend pede libero quis orci nullam molestie,644,false,2024-06-19 14:57:55
807,219,Message,parturient montes nascetur ridiculus mus,981,true,2024-07-08 13:38:03
808,932,Message,natoque penatibus et magnis dis parturient montes nascetur ridiculus mus etiam,199,true,2024-10-01 18:33:39
809,263,Message,nulla ac enim in tempor turpis nec euismod scelerisque quam turpis adipiscing lorem vitae mattis nibh ligula nec sem,665,true,2024-07-24 01:23:51
810,572,Message,erat quisque erat eros viverra eget congue eget semper rutrum nulla nunc purus phasellus in felis,17,true,2024-01-10 12:55:20
811,318,Message,ut mauris eget massa tempor convallis nulla neque libero convallis eget,510,true,2024-01-07 11:33:55
812,706,Message,blandit mi in porttitor pede justo eu massa donec dapibus duis at velit eu,804,false,2024-05-05 19:46:29
813,531,Message,aliquet massa id lobortis convallis tortor risus dapibus augue vel accumsan tellus nisi eu orci mauris lacinia sapien,453,true,2024-05-20 22:52:15
814,833,Message,ut tellus nulla ut erat id mauris vulputate elementum,874,false,2024-02-01 08:44:28
815,567,Message,mauris non ligula pellentesque ultrices phasellus id sapien in sapien iaculis,551,true,2024-03-26 18:15:37
816,430,Message,arcu sed augue aliquam erat volutpat in congue etiam,771,false,2024-12-01 11:58:44
817,211,Message,diam id ornare imperdiet sapien urna pretium nisl ut volutpat sapien arcu,968,true,2024-10-05 00:24:15
818,276,Message,eget massa tempor convallis nulla neque libero convallis eget eleifend luctus ultricies eu nibh quisque id,886,false,2024-09-05 13:35:25
819,478,Message,non ligula pellentesque ultrices phasellus id sapien in sapien iaculis congue vivamus metus arcu adipiscing molestie,526,true,2024-09-21 11:20:17
