PostID,UserID,PostType,Content,RecipientID,Visible,CreationTime
411,994,Message,ante ipsum primis in faucibus orci luctus et ultrices,944,false,2024-09-20 12:37:06
412,22,Message,aliquam erat volutpat in congue etiam justo etiam pretium iaculis justo in hac habitasse platea dictumst etiam faucibus,348,true,2024-02-22 17:02:57
413,764,Message,tortor quis turpis sed ante vivamus tortor duis mattis egestas metus aenean fermentum donec ut,377,true,2024-12-30 05:35:06
414,495,Message,sapien cursus vestibulum proin eu mi nulla ac enim in tempor turpis nec euismod scelerisque quam,86,false,2024-10-21 03:17:19
415,731,Message,sed augue aliquam erat volutpat in congue etiam justo etiam pretium iaculis,696,false,2024-05-27 06:04:12
416,365,Message,nunc purus phasellus in felis donec,557,true,2024-03-31 02:49:04
417,479,Message,justo in blandit ultrices enim lorem ipsum dolor sit amet consectetuer adipiscing elit proin,907,false,2024-10-22 20:20:04
418,97,Message,lacinia eget tincidunt eget tempus vel pede morbi porttitor,342,false,2024-01-29 22:48:23
419,268,Message,auctor sed tristique in tempus sit amet sem fusce consequat nulla nisl nunc nisl duis bibendum felis sed interdum,653,false,2024-11-30 07:33:18
420,484,Message,in lacus curabitur at ipsum ac tellus semper interdum mauris ullamcorper purus sit amet nulla quisque,14,false,2024-03-01 12:51:44
421,861,Message,in faucibus orci luctus et ultrices posuere cubilia curae mauris viverra diam vitae quam suspendisse potenti nullam porttitor lacus at,974,false,2024-10-23 13:10:01
422,300,Message,libero convallis eget eleifend luctus ultricies eu nibh quisque id justo sit amet sapien dignissim vestibulum vestibulum,510,true,2024-09-01 03:56:24
423,251,Message,phasellus in felis donec semper,302,true,2024-04-01 03:48:05
424,833,Message,dolor sit amet consectetuer adipiscing elit proin risus praesent lectus vestibulum quam sapien,571,true,2024-07-25 15:19:58
425,927,Message,elit sodales scelerisque mauris sit amet eros suspendisse accumsan tortor quis turpis sed ante vivamus tortor duis,504,true,2024-03-07 10:10:07
426,396,Message,donec posuere metus vitae ipsum aliquam non mauris morbi non,208,false,2024-10-10 14:19:24
427,224,Message,et tempus semper est quam pharetra magna ac consequat metus sapien ut nunc vestibulum,167,true,2024-02-01 20:04:34
428,227,Message,felis ut at dolor quis odio consequat varius integer,240,true,2024-09-30 20:22:45
429,873,Message,natoque penatibus et magnis dis parturient montes nascetur ridiculus mus etiam vel augue vestibulum rutrum rutrum neque,785,false,2024-04-11 04:43:33
430,35,Message,nam dui proin leo odio porttitor id consequat,973,false,2024-11-26 02:36:38
431,434,Message,odio donec vitae nisi nam,930,true,2024-01-11 08:42:46
432,144,Message,erat eros viverra eget congue eget semper rutrum nulla nunc,615,false,2024-04-25 21:43:56
433,747,Message,dui luctus rutrum nulla tellus in sagittis dui vel nisl duis ac nibh fusce lacus purus aliquet at feugiat non,686,true,2024-05-16 23:15:16
434,682,Message,nulla nisl nunc nisl duis bibendum felis sed interdum venenatis turpis enim blandit mi in porttitor pede justo,914,true,2024-10-26 01:13:20
435,348,Message,sit amet turpis elementum ligula vehicula consequat morbi a ipsum integer,954,true,2024-01-19 07:55:16
436,420,Message,etiam faucibus cursus urna ut tellus nulla ut erat id mauris vulputate elementum nullam varius nulla facilisi cras,31,false,2024-02-19 14:42:05
437,51,Message,eget rutrum at lorem integer tincidunt ante vel ipsum praesent blandit lacinia erat,3,false,2024-09-14 14:37:21
438,636,Message,erat vestibulum sed magna at nunc commodo placerat praesent blandit nam nulla integer pede,357,true,2024-12-19 15:24:22
439,474,Message,pellentesque ultrices mattis odio donec vitae nisi nam ultrices libero non,24,false,2024-04-15 17:39:28
440,465,Message,donec dapibus duis at velit eu est congue elementum in hac habitasse platea dictumst morbi vestibulum velit,478,false,2024-08-15 21:27:42
441,252,Message,turpis sed ante vivamus tortor duis mattis egestas metus aenean fermentum donec ut mauris,946,false,2024-08-29 15:27:32
442,497,Message,ipsum aliquam non mauris morbi non lectus aliquam sit amet diam in magna bibendum imperdiet nullam orci pede venenatis non,709,true,2024-04-19 05:43:41
443,356,Message,ut tellus nulla ut erat id,571,true,2024-02-11 00:28:52
444,798,Message,aliquam non mauris morbi non lectus aliquam sit amet diam,866,true,2024-11-12 12:52:32
445,11,Message,potenti in eleifend quam a odio in hac habitasse,897,true,2024-07-04 06:35:17
446,141,Message,ut nulla sed accumsan felis ut at dolor quis odio consequat varius,569,true,2024-03-04 03:18:03
447,997,Message,amet sapien dignissim vestibulum vestibulum ante ipsum primis in faucibus orci luctus et ultrices posuere cubilia curae nulla dapibus,421,true,2024-08-29 15:32:13
448,514,Message,elit sodales scelerisque mauris sit amet,571,false,2024-08-17 23:57:39
449,410,Message,ipsum aliquam non mauris morbi non lectus aliquam sit amet diam in magna bibendum imperdiet nullam orci pede,936,true,2024-10-25 03:36:48
450,420,Message,praesent blandit lacinia erat vestibulum,780,true,2024-10-28 07:42:49
451,40,Message,erat nulla tempus vivamus in,465,true,2024-08-24 06:20:37
452,525,Message,et ultrices posuere cubilia curae nulla,285,false,2024-06-20 13:52:06
453,740,Message,eu interdum eu tincidunt in leo maecenas pulvinar,369,true,2024-11-24 11:31:05
454,449,Message,consequat dui nec nisi volutpat eleifend donec ut dolor morbi vel lectus in quam fringilla rhoncus mauris enim leo,51,true,2024-07-17 01:06:35
455,81,Message,et magnis dis parturient montes nascetur ridiculus mus etiam vel augue vestibulum rutrum rutrum,483,true,2024-03-07 02:11:05
456,893,Message,rutrum nulla tellus in sagittis dui vel nisl duis ac nibh fusce lacus purus aliquet,958,true,2024-10-22 14:33:04
457,885,Message,est quam pharetra magna ac consequat metus sapien ut nunc vestibulum ante ipsum primis in faucibus orci luctus et,690,false,2024-02-29 20:16:34
458,925,Message,blandit mi in porttitor pede justo eu massa donec dapibus duis at velit eu,536,true,2024-11-30 03:17:27
459,717,Message,eu est congue elementum in hac,922,false,2024-07-22 21:50:30
460,839,Message,porta volutpat erat quisque erat eros viverra eget congue eget semper rutrum nulla nunc purus phasellus,882,false,2024-09-11 11:08:24
461,673,Message,ut tellus nulla ut erat id mauris vulputate elementum nullam,788,false,2024-08-03 10:36:51
462,249,Message,dis parturient montes nascetur ridiculus mus vivamus vestibulum sagittis,578,false,2024-05-02 07:54:26
463,55,Message,integer tincidunt ante vel ipsum praesent blandit lacinia erat vestibulum,128,false,2024-05-31 13:09:48
464,312,Message,pulvinar lobortis est phasellus sit amet erat nulla tempus vivamus in felis eu sapien,503,true,2024-11-13 20:21:34
465,896,Message,fusce lacus purus aliquet at feugiat non pretium quis,772,true,2024-02-01 20:06:52
466,669,Message,maecenas tincidunt lacus at velit vivamus vel,827,true,2024-02-09 12:40:04
467,567,Message,in faucibus orci luctus et ultrices posuere cubilia curae nulla,636,false,2024-05-15 18:32:52
468,240,Message,condimentum curabitur in libero ut massa volutpat convallis morbi odio odio elementum eu interdum eu tincidunt in leo,189,true,2024-11-07 20:44:04
469,786,Message,mus vivamus vestibulum sagittis sapien cum sociis natoque penatibus et magnis dis parturient montes,479,true,2024-09-01 21:24:44
470,742,Message,nec molestie sed justo pellentesque viverra pede ac diam cras pellentesque volutpat dui maecenas tristique est et tempus,301,false,2024-01-02 08:03:23
471,714,Message,nisl duis ac nibh fusce lacus purus,898,true,2024-07-11 21:14:44
472,639,Message,id pretium iaculis diam erat fermentum justo nec,697,false,2024-09-26 13:43:19
473,66,Message,placerat ante nulla justo aliquam quis turpis eget elit sodales scelerisque,7,true,2024-02-27 21:03:28
474,923,Message,metus vitae ipsum aliquam non mauris morbi non lectus aliquam sit,939,true,2024-11-06 12:29:17
475,586,Message,adipiscing molestie hendrerit at vulputate vitae nisl aenean lectus,259,false,2024-02-26 01:04:10
476,528,Message,lectus suspendisse potenti in eleifend,606,true,2024-05-03 04:59:19
477,954,Message,nulla nunc purus phasellus in felis donec semper sapien a libero nam dui proin leo,416,true,2024-02-18 11:52:03
478,548,Message,dui proin leo odio porttitor id consequat in consequat ut,688,true,2024-05-14 22:52:06
479,452,Message,nunc nisl duis bibendum felis sed interdum venenatis turpis enim blandit mi in porttitor,29,false,2024-06-29 05:26:01
480,298,Message,orci mauris lacinia sapien quis libero nullam sit amet turpis elementum ligula vehicula consequat morbi a,574,false,2024-06-03 20:02:15
481,424,Message,ut mauris eget massa tempor convallis nulla neque libero convallis eget eleifend,231,true,2024-07-06 06:32:11
482,147,Message,ultrices mattis odio donec vitae,569,true,2024-11-06 22:44:42
483,366,Message,tellus semper interdum mauris ullamcorper purus sit amet nulla quisque arcu,727,false,2024-06-06 23:21:40
484,98,Message,tellus nulla ut erat id mauris vulputate elementum nullam varius nulla facilisi cras non velit nec,808,true,2024-03-03 20:08:47
485,752,Message,eleifend luctus ultricies eu nibh,351,false,2024-04-16 08:52:00
486,453,Message,orci eget orci vehicula condimentum curabitur in libero ut massa,934,false,2024-09-23 09:53:43
487,733,Message,dapibus duis at velit eu est congue elementum in hac habitasse platea dictumst morbi vestibulum velit id pretium,830,false,2024-03-30 01:17:20
488,544,Message,rutrum neque aenean auctor gravida sem praesent id massa id nisl venenatis lacinia,461,true,2024-01-04 11:38:19
489,455,Message,in tempor turpis nec euismod scelerisque quam turpis adipiscing lorem vitae mattis nibh ligula nec sem duis aliquam,62,true,2024-01-18 13:51:01
490,260,Message,posuere cubilia curae duis faucibus accumsan odio curabitur convallis duis consequat,664,false,2024-08-01 20:27:06
491,281,Message,diam neque vestibulum eget vulputate ut ultrices vel augue vestibulum ante ipsum primis in faucibus orci luctus et ultrices posuere,568,true,2024-07-09 23:43:00
492,583,Message,orci luctus et ultrices posuere cubilia curae donec pharetra magna vestibulum aliquet ultrices,730,true,2024-10-11 02:40:19
493,164,Message,pede malesuada in imperdiet et commodo vulputate justo in blandit ultrices enim lorem,832,false,2024-10-21 00:45:00
494,587,Message,id nulla ultrices aliquet maecenas leo odio condimentum id luctus nec molestie sed justo pellentesque,145,true,2024-11-22 01:03:38
495,212,Message,elit ac nulla sed vel enim,820,false,2024-12-26 17:09:31
496,493,Message,faucibus orci luctus et ultrices posuere cubilia curae mauris viverra diam vitae quam suspendisse potenti nullam,321,false,2024-02-01 04:04:43
497,463,Message,lobortis convallis tortor risus dapibus augue vel accumsan tellus nisi,642,false,2024-12-06 00:06:53
498,383,Message,vulputate justo in blandit ultrices enim lorem ipsum dolor sit,366,true,2024-11-28 17:54:30
499,962,Message,hac habitasse platea dictumst morbi vestibulum velit id,325,false,2024-06-04 13:53:52
500,787,Message,tincidunt lacus at velit vivamus vel nulla,36,true,2024-12-08 23:16:47
501,533,Message,amet sapien dignissim vestibulum vestibulum ante ipsum primis in faucibus orci luctus et ultrices posuere cubilia,648,false,2024-10-02 16:42:10
502,786,Message,ante ipsum primis in faucibus orci luctus et ultrices posuere cubilia curae mauris viverra diam vitae quam suspendisse,379,false,2024-08-08 17:48:43
503,361,Message,nulla nisl nunc nisl duis bibendum felis sed interdum venenatis turpis enim,121,false,2024-01-31 08:15:53
504,138,Message,cum sociis natoque penatibus et magnis dis parturient montes nascetur ridiculus mus etiam vel augue vestibulum,765,true,2024-05-29 16:52:58
505,549,Message,amet cursus id turpis integer aliquet massa id lobortis convallis tortor risus dapibus augue vel accumsan,129,true,2024-08-08 17:01:03
506,981,Message,congue risus semper porta volutpat quam pede lobortis ligula sit amet eleifend pede libero quis orci nullam,651,false,2024-03-10 20:10:13
507,516,Message,at vulputate vitae nisl aenean lectus pellentesque eget nunc donec quis,608,true,2024-08-11 04:03:51
508,156,Message,suspendisse potenti nullam porttitor lacus at turpis donec posuere metus,842,false,2024-09-14 01:34:37
509,924,Message,sed ante vivamus tortor duis,959,true,2024-10-13 20:59:31
510,938,Message,nulla pede ullamcorper augue a suscipit nulla elit ac nulla sed vel enim sit,281,true,2024-05-11 12:57:49
511,883,Message,ligula pellentesque ultrices phasellus id sapien in sapien iaculis congue vivamus metus arcu adipiscing molestie hendrerit at,11,false,2024-03-06 22:09:02
512,863,Message,in hac habitasse platea dictumst etiam faucibus cursus urna ut tellus nulla,151,true,2024-09-23 18:19:28
513,209,Message,non velit nec nisi vulputate nonummy maecenas tincidunt lacus at velit vivamus vel nulla eget eros,189,true,2024-03-23 02:41:59
514,412,Message,et ultrices posuere cubilia curae donec pharetra magna vestibulum aliquet ultrices erat tortor sollicitudin mi sit amet lobortis sapien,876,true,2024-01-17 11:06:03
515,114,Message,condimentum id luctus nec molestie sed justo pellentesque viverra pede,978,false,2024-12-12 17:43:35
516,126,Message,mauris enim leo rhoncus sed vestibulum sit amet cursus id turpis integer aliquet massa id,988,false,2024-03-19 06:48:37
517,554,Message,tincidunt in leo maecenas pulvinar lobortis est phasellus sit amet erat nulla tempus vivamus,298,true,2024-03-07 17:35:00
518,517,Message,lorem integer tincidunt ante vel ipsum praesent blandit lacinia erat vestibulum sed magna at nunc commodo placerat praesent blandit nam,468,false,2024-03-02 07:48:10
519,839,Message,sem fusce consequat nulla nisl nunc nisl duis bibendum felis sed interdum venenatis turpis,755,false,2024-01-10 02:51:43
520,950,Message,dapibus augue vel accumsan tellus nisi eu orci mauris lacinia sapien quis libero nullam sit amet turpis,951,true,2024-09-16 06:17:28
521,882,Message,primis in faucibus orci luctus et ultrices posuere cubilia curae nulla dapibus dolor vel est donec,905,false,2024-11-30 17:11:01
522,609,Message,lacus at velit vivamus vel nulla eget eros elementum pellentesque quisque porta volutpat erat,871,true,2024-12-20 11:33:06
523,549,Message,at lorem integer tincidunt ante vel ipsum praesent blandit lacinia erat vestibulum sed magna at nunc,65,false,2024-07-19 15:35:34
524,735,Message,elit proin risus praesent lectus vestibulum quam sapien varius,5,true,2024-04-27 04:31:11
525,999,Message,pellentesque volutpat dui maecenas tristique est et tempus semper est quam pharetra magna ac consequat metus,979,true,2024-10-17 02:22:01
526,827,Message,velit id pretium iaculis diam erat,945,true,2024-06-30 13:47:34
527,624,Message,mauris sit amet eros suspendisse accumsan tortor quis turpis sed ante vivamus tortor duis,420,false,2024-02-11 03:55:37
528,684,Message,ut nunc vestibulum ante ipsum primis in faucibus orci luctus,34,true,2024-05-04 05:52:00
529,27,Message,aliquet pulvinar sed nisl nunc,845,true,2024-09-09 21:33:01
530,953,Message,eget congue eget semper rutrum nulla nunc,741,true,2024-02-24 09:43:42
531,874,Message,rutrum nulla nunc purus phasellus in felis donec semper sapien a,911,true,2024-07-13 04:33:57
532,485,Message,dolor quis odio consequat varius integer,61,false,2024-11-04 01:28:50
533,476,Message,mauris enim leo rhoncus sed vestibulum sit amet cursus id turpis integer aliquet massa id lobortis convallis tortor risus,157,true,2024-10-01 13:18:30
534,786,Message,at turpis donec posuere metus vitae ipsum aliquam non mauris morbi non lectus aliquam,722,false,2024-12-11 11:50:06
535,612,Message,a libero nam dui proin leo odio porttitor,976,false,2024-02-04 04:14:43
536,288,Message,ut ultrices vel augue vestibulum,150,true,2024-07-24 05:41:05
537,791,Message,turpis nec euismod scelerisque quam turpis adipiscing lorem vitae,682,false,2024-04-13 23:40:10
538,523,Message,sapien ut nunc vestibulum ante ipsum primis in faucibus orci,259,false,2024-04-03 21:40:27
539,994,Message,potenti in eleifend quam a odio in hac habitasse platea dictumst maecenas ut,492,false,2024-07-31 04:26:44
540,827,Message,id pretium iaculis diam erat fermentum justo nec condimentum neque sapien placerat ante nulla justo,68,false,2024-11-28 12:48:42
541,821,Message,morbi a ipsum integer a nibh in,835,false,2024-12-03 05:17:45
542,45,Message,volutpat eleifend donec ut dolor morbi vel lectus in quam fringilla rhoncus mauris,539,true,2024-10-20 22:40:29
543,562,Message,etiam pretium iaculis justo in hac habitasse,733,false,2024-04-22 20:21:12
544,983,Message,interdum eu tincidunt in leo maecenas pulvinar lobortis est phasellus sit amet erat nulla tempus vivamus,890,true,2024-01-01 14:18:05
545,352,Message,sodales scelerisque mauris sit amet eros suspendisse accumsan tortor quis turpis sed ante,789,false,2024-07-15 21:57:32
546,799,Message,porta volutpat quam pede lobortis ligula sit amet eleifend pede libero quis orci nullam molestie nibh in,986,true,2024-11-21 10:51:57
547,395,Message,vestibulum ante ipsum primis in faucibus orci luctus et ultrices posuere,9,false,2024-12-13 00:27:25
548,963,Message,porttitor pede justo eu massa,626,true,2024-11-10 10:21:48
549,257,Message,turpis donec posuere metus vitae ipsum aliquam,735,true,2024-08-30 18:55:43
550,796,Message,proin at turpis a pede posuere nonummy,174,false,2024-11-09 19:34:14
551,61,Message,mi pede malesuada in imperdiet et commodo vulputate justo in blandit,780,false,2024-01-07 16:37:14
552,716,Message,pellentesque volutpat dui maecenas tristique est et tempus,108,true,2024-11-12 11:21:31
553,941,Message,eget vulputate ut ultrices vel augue vestibulum ante ipsum primis,110,true,2024-06-12 13:45:08
554,374,Message,mattis odio donec vitae nisi nam ultrices libero non mattis pulvinar nulla pede ullamcorper augue a suscipit,981,false,2024-02-29 04:48:20
555,185,Message,in hac habitasse platea dictumst maecenas ut massa quis augue luctus tincidunt nulla mollis,731,false,2024-12-03 02:58:32
556,770,Message,magnis dis parturient montes nascetur ridiculus mus etiam vel augue vestibulum,731,false,2024-09-27 19:13:22
557,794,Message,consequat in consequat ut nulla sed accumsan felis ut at dolor quis odio consequat,127,true,2024-12-07 10:30:19
558,661,Message,at nunc commodo placerat praesent blandit nam nulla integer pede justo lacinia eget tincidunt eget,501,false,2024-04-28 19:40:35
559,73,Message,nam congue risus semper porta volutpat quam pede lobortis ligula,713,false,2024-11-02 03:13:02
560,36,Message,in faucibus orci luctus et ultrices posuere cubilia curae mauris viverra diam vitae,893,false,2024-11-19 04:04:50
561,298,Message,habitasse platea dictumst etiam faucibus cursus urna ut tellus,718,false,2024-06-10 22:27:01
562,61,Message,risus dapibus augue vel accumsan tellus nisi eu orci mauris lacinia,688,false,2024-09-06 18:00:03
563,995,Message,molestie sed justo pellentesque viverra pede ac,205,false,2024-09-07 21:26:17
564,613,Message,blandit ultrices enim lorem ipsum dolor sit amet consectetuer adipiscing elit,827,false,2024-03-04 15:06:53
565,837,Message,dolor quis odio consequat varius integer ac leo pellentesque ultrices mattis odio donec vitae nisi nam,509,false,2024-11-09 09:42:30
566,406,Message,quis augue luctus tincidunt nulla mollis molestie lorem quisque,200,true,2024-05-10 08:27:11
567,509,Message,amet sem fusce consequat nulla nisl,669,false,2024-01-29 06:00:31
568,622,Message,proin risus praesent lectus vestibulum quam sapien varius ut blandit non interdum in ante vestibulum ante ipsum primis in faucibus,871,false,2024-04-06 08:16:49
569,292,Message,leo odio condimentum id luctus nec molestie sed justo pellentesque viverra pede ac,363,false,2024-10-28 03:35:31
570,617,Message,amet eleifend pede libero quis orci nullam molestie nibh in lectus pellentesque at nulla suspendisse potenti cras,416,false,2024-09-06 10:38:15
571,385,Message,vitae consectetuer eget rutrum at lorem integer,164,false,2024-06-25 06:27:32
572,609,Message,ligula nec sem duis aliquam convallis nunc proin at turpis,277,true,2024-01-01 08:23:34
573,667,Message,dapibus duis at velit eu est congue elementum in,301,true,2024-08-25 21:16:38
574,383,Message,sollicitudin vitae consectetuer eget rutrum at lorem integer tincidunt ante vel ipsum praesent blandit lacinia erat vestibulum sed magna,282,false,2024-04-05 19:33:48
575,547,Message,dui proin leo odio porttitor id consequat in consequat ut nulla,205,true,2024-09-19 15:59:19
576,711,Message,at nunc commodo placerat praesent blandit nam nulla integer,328,true,2024-11-16 09:06:48
577,899,Message,lorem vitae mattis nibh ligula nec sem duis aliquam convallis nunc proin at turpis a pede posuere nonummy integer,684,false,2024-04-10 08:37:10
578,721,Message,ipsum dolor sit amet consectetuer adipiscing elit proin risus,574,false,2024-01-15 12:00:35
579,172,Message,morbi sem mauris laoreet ut rhoncus aliquet pulvinar,959,false,2024-06-12 11:40:17
580,128,Message,sodales scelerisque mauris sit amet eros suspendisse accumsan tortor,9,false,2024-08-16 21:03:41
581,538,Message,maecenas ut massa quis augue,912,false,2024-12-05 03:02:07
582,925,Message,facilisi cras non velit nec nisi vulputate nonummy maecenas tincidunt lacus at velit vivamus vel nulla,699,true,2024-11-13 14:11:08
583,817,Message,porttitor lorem id ligula suspendisse ornare consequat lectus in,984,false,2024-03-11 10:11:46
584,345,Message,lorem ipsum dolor sit amet consectetuer adipiscing elit proin risus praesent lectus vestibulum,109,true,2024-12-22 13:10:45
585,536,Message,in hac habitasse platea dictumst maecenas ut massa quis,193,true,2024-05-18 06:15:30
586,908,Message,massa quis augue luctus tincidunt nulla mollis molestie lorem,950,false,2024-12-28 14:09:53
587,151,Message,sed tincidunt eu felis fusce posuere felis sed lacus morbi sem,53,true,2024-11-08 20:58:54
588,560,Message,ligula suspendisse ornare consequat lectus in est risus auctor,260,false,2024-03-03 23:58:46
589,326,Message,erat tortor sollicitudin mi sit amet lobortis sapien sapien non mi integer ac,262,true,2024-04-28 00:30:39
590,506,Message,duis at velit eu est congue elementum in hac habitasse platea dictumst morbi vestibulum,157,true,2024-04-20 05:29:07
591,520,Message,vestibulum eget vulputate ut ultrices vel augue vestibulum,677,false,2024-03-23 04:08:03
592,248,Message,imperdiet nullam orci pede venenatis,341,true,2024-11-10 20:33:02
593,196,Message,amet cursus id turpis integer aliquet massa id lobortis convallis tortor risus dapibus augue vel,399,false,2024-02-25 21:07:26
594,467,Message,pretium iaculis justo in hac habitasse platea dictumst etiam faucibus cursus urna ut tellus nulla ut,717,true,2024-01-04 06:19:14
595,640,Message,faucibus orci luctus et ultrices posuere cubilia curae mauris viverra diam vitae quam suspendisse potenti nullam porttitor,872,true,2024-05-23 21:44:18
596,209,Message,condimentum curabitur in libero ut massa volutpat convallis morbi odio odio elementum eu interdum eu,757,true,2024-10-24 21:12:13
597,655,Message,erat eros viverra eget congue eget semper rutrum nulla nunc purus phasellus,324,false,2024-12-15 21:16:35
598,843,Message,sodales sed tincidunt eu felis fusce posuere felis sed lacus morbi sem mauris laoreet ut rhoncus aliquet pulvinar sed,875,true,2024-04-19 15:05:01
599,672,Message,at nibh in hac habitasse platea dictumst aliquam augue quam sollicitudin,726,true,2024-01-03 22:37:18
600,866,Message,gravida sem praesent id massa id nisl venenatis lacinia aenean sit amet justo,779,true,2024-07-28 15:13:29
601,491,Message,scelerisque quam turpis adipiscing lorem vitae mattis nibh ligula nec sem duis aliquam convallis nunc,280,false,2024-10-30 03:44:58
602,308,Message,justo sit amet sapien dignissim vestibulum vestibulum ante,805,false,2024-09-05 03:49:10
603,899,Message,tempor turpis nec euismod scelerisque quam turpis adipiscing lorem vitae mattis nibh ligula nec sem duis aliquam convallis nunc proin,153,true,2024-05-29 12:08:36
604,459,Message,eu est congue elementum in hac habitasse platea dictumst morbi vestibulum velit,606,false,2024-02-17 07:55:33
605,661,Message,id turpis integer aliquet massa id lobortis convallis tortor risus dapibus augue vel accumsan,301,true,2024-08-29 17:36:42
606,370,Message,massa volutpat convallis morbi odio odio elementum eu interdum eu tincidunt in leo maecenas pulvinar lobortis est phasellus,552,true,2024-04-15 15:11:24
607,924,Message,nisl duis bibendum felis sed interdum venenatis turpis enim,707,false,2024-11-04 02:48:37
608,126,Message,sit amet eros suspendisse accumsan tortor,411,true,2024-03-12 03:30:02
609,328,Message,turpis adipiscing lorem vitae mattis nibh ligula nec sem duis aliquam convallis nunc proin at turpis,424,false,2024-07-18 23:36:49
610,768,Message,imperdiet et commodo vulputate justo in blandit,177,false,2024-10-10 07:42:32
611,22,Message,consequat nulla nisl nunc nisl duis bibendum felis sed,706,false,2024-07-14 18:48:48
612,526,Message,velit id pretium iaculis diam erat fermentum justo nec condimentum neque sapien placerat ante nulla justo aliquam quis turpis,163,false,2024-01-26 07:34:04
613,715,Message,amet nunc viverra dapibus nulla suscipit ligula,769,false,2024-11-12 21:05:50
614,432,Message,purus aliquet at feugiat non pretium quis lectus suspendisse potenti in eleifend quam a odio in,589,true,2024-09-04 22:37:28
615,758,Message,ridiculus mus vivamus vestibulum sagittis sapien,481,true,2024-06-19 03:12:42
616,204,Message,eu magna vulputate luctus cum sociis natoque penatibus et,345,true,2024-07-17 08:05:41
617,617,Message,amet eros suspendisse accumsan tortor quis turpis sed ante vivamus tortor duis mattis,798,false,2024-06-22 11:03:51
618,38,Message,lorem ipsum dolor sit amet consectetuer,633,true,2024-07-19 10:04:02
619,787,Message,ipsum primis in faucibus orci luctus et ultrices posuere cubilia curae nulla dapibus dolor vel est donec,967,false,2024-09-16 09:57:13
