PostID,UserID,PostType,Content,RecipientID,Visible,CreationTime
1,737,Message,magnis dis parturient montes nascetur ridiculus mus etiam vel augue vestibulum rutrum rutrum neque aenean auctor gravida,549,true,2024-10-31 19:25:59
2,200,Message,sagittis dui vel nisl duis ac nibh fusce lacus purus aliquet at feugiat non pretium quis lectus suspendisse,587,false,2024-06-22 17:18:07
3,750,Message,ipsum praesent blandit lacinia erat vestibulum sed magna at nunc commodo,98,false,2024-12-20 16:35:12
4,611,Message,vitae ipsum aliquam non mauris morbi non lectus aliquam sit amet diam in magna bibendum imperdiet nullam orci,244,false,2024-03-26 15:26:51
5,521,Message,sagittis nam congue risus semper porta volutpat quam pede lobortis ligula sit amet eleifend pede,854,false,2024-08-13 21:56:06
6,859,Message,faucibus orci luctus et ultrices,111,true,2024-11-22 21:56:35
7,938,Message,id sapien in sapien iaculis congue vivamus metus arcu adipiscing molestie hendrerit at vulputate vitae,349,false,2024-10-17 07:49:59
8,195,Message,eget tempus vel pede morbi porttitor lorem id ligula suspendisse ornare consequat lectus in est risus auctor sed tristique in,23,true,2024-08-05 14:55:04
9,130,Message,ultrices enim lorem ipsum dolor sit amet consectetuer,849,false,2024-11-10 12:29:40
10,162,Message,non mattis pulvinar nulla pede ullamcorper augue a,536,true,2024-01-13 10:36:18
11,388,Message,augue quam sollicitudin vitae consectetuer eget rutrum at lorem integer tincidunt ante vel ipsum praesent blandit lacinia erat,84,true,2024-11-29 02:21:15
12,892,Message,id lobortis convallis tortor risus dapibus augue vel accumsan tellus nisi eu orci,499,false,2024-09-21 15:05:44
13,529,Message,fusce consequat nulla nisl nunc nisl duis,879,true,2024-07-26 01:52:02
14,491,Message,consequat ut nulla sed accumsan felis ut at dolor quis,223,false,2024-05-04 13:00:25
15,479,Message,in blandit ultrices enim lorem ipsum dolor sit amet consectetuer adipiscing elit,903,false,2024-05-30 03:55:05
16,90,Message,donec diam neque vestibulum eget vulputate,432,false,2024-11-14 08:20:25
17,41,Message,semper interdum mauris ullamcorper purus sit amet nulla quisque arcu libero rutrum ac lobortis vel dapibus at diam nam,927,true,2024-08-09 17:26:43
18,954,Message,in leo maecenas pulvinar lobortis est phasellus sit,558,true,2024-04-11 21:44:44
19,550,Message,sit amet diam in magna bibendum imperdiet,631,false,2024-02-13 02:13:40
20,531,Message,odio condimentum id luctus nec molestie sed justo,549,true,2024-04-27 10:05:02
21,902,Message,blandit mi in porttitor pede justo eu massa donec dapibus duis at velit eu est congue elementum in hac,541,false,2024-07-09 05:42:52
22,52,Message,fusce lacus purus aliquet at feugiat non pretium quis lectus suspendisse potenti in eleifend quam a odio in,979,false,2024-04-25 05:12:34
23,907,Message,lacinia sapien quis libero nullam sit amet turpis elementum ligula vehicula consequat morbi a ipsum integer,850,true,2024-12-12 19:15:41
24,155,Message,praesent id massa id nisl venenatis lacinia aenean,799,false,2024-10-11 01:30:38
25,999,Message,ac consequat metus sapien ut nunc,545,true,2024-05-11 10:40:23
26,751,Message,vitae mattis nibh ligula nec sem duis aliquam convallis nunc proin at turpis a pede,546,true,2024-10-31 08:31:02
27,214,Message,mattis egestas metus aenean fermentum donec ut mauris eget massa tempor,446,false,2024-02-06 22:55:56
28,5,Message,tristique est et tempus semper est quam pharetra,425,false,2024-09-16 04:22:43
29,377,Message,ut massa volutpat convallis morbi odio odio elementum eu interdum eu tincidunt in leo,292,false,2024-11-18 05:54:46
30,552,Message,posuere nonummy integer non velit donec diam neque vestibulum,445,true,2024-10-27 00:48:58
31,787,Message,in faucibus orci luctus et ultrices posuere cubilia curae donec pharetra magna vestibulum aliquet ultrices erat,870,false,2024-08-10 11:49:55
32,943,Message,ultrices erat tortor sollicitudin mi sit amet lobortis,875,true,2024-12-08 08:59:12
33,635,Message,posuere metus vitae ipsum aliquam non mauris morbi non lectus aliquam sit amet,958,false,2024-02-20 15:17:24
34,296,Message,vulputate vitae nisl aenean lectus pellentesque eget nunc donec quis orci eget orci vehicula condimentum curabitur in,757,true,2024-12-15 23:06:18
35,812,Message,etiam justo etiam pretium iaculis justo in hac habitasse platea dictumst etiam,325,true,2024-04-16 17:43:37
36,126,Message,in leo maecenas pulvinar lobortis est phasellus sit amet erat nulla tempus vivamus in felis eu sapien,450,true,2024-06-17 13:00:15
37,185,Message,at ipsum ac tellus semper interdum mauris ullamcorper purus sit amet nulla quisque arcu libero rutrum ac lobortis,728,false,2024-05-17 14:00:39
38,371,Message,augue vel accumsan tellus nisi eu orci mauris lacinia sapien quis libero nullam sit,15,false,2024-03-27 21:30:00
39,7,Message,amet cursus id turpis integer aliquet massa id lobortis convallis tortor risus dapibus augue vel accumsan tellus nisi eu,254,true,2024-03-25 03:48:28
40,56,Message,laoreet ut rhoncus aliquet pulvinar sed,636,false,2024-04-21 22:04:56
41,608,Message,ante vel ipsum praesent blandit,265,false,2024-07-14 12:01:45
42,333,Message,mattis odio donec vitae nisi nam ultrices libero non mattis,328,false,2024-06-11 21:52:32
43,655,Message,ipsum aliquam non mauris morbi non lectus aliquam sit amet diam in,699,false,2024-09-19 04:23:23
44,98,Message,cras pellentesque volutpat dui maecenas,335,false,2024-06-15 21:21:30
45,993,Message,molestie hendrerit at vulputate vitae nisl aenean lectus pellentesque,695,false,2024-09-13 18:43:41
46,305,Message,non velit donec diam neque vestibulum eget vulputate ut ultrices vel augue vestibulum ante,338,false,2024-08-15 15:07:19
47,14,Message,dui maecenas tristique est et,561,false,2024-09-27 04:47:42
48,835,Message,duis consequat dui nec nisi volutpat eleifend donec ut dolor morbi vel lectus in,413,true,2024-06-16 02:32:41
49,689,Message,pede libero quis orci nullam molestie nibh in lectus pellentesque at,791,false,2024-01-29 03:10:21
50,606,Message,pulvinar sed nisl nunc rhoncus dui vel,187,true,2024-06-05 04:16:44
51,402,Message,hac habitasse platea dictumst etiam faucibus cursus urna ut tellus nulla ut erat id mauris vulputate elementum nullam,494,true,2024-06-05 08:02:51
52,910,Message,eget eros elementum pellentesque quisque porta volutpat erat quisque erat eros viverra eget,944,true,2024-06-14 02:27:52
53,155,Message,ligula nec sem duis aliquam convallis nunc proin at turpis a pede posuere,317,true,2024-03-15 20:37:06
54,311,Message,neque aenean auctor gravida sem praesent id massa id,471,true,2024-01-11 13:58:32
55,396,Message,neque aenean auctor gravida sem praesent id massa id nisl venenatis lacinia aenean sit amet justo,572,false,2024-08-10 17:57:49
56,378,Message,tincidunt in leo maecenas pulvinar lobortis est phasellus sit,591,true,2024-07-25 23:08:32
57,745,Message,urna ut tellus nulla ut erat id mauris,515,false,2024-07-29 13:09:36
58,860,Message,neque libero convallis eget eleifend luctus,113,true,2024-09-30 10:14:15
59,826,Message,mauris viverra diam vitae quam suspendisse potenti nullam porttitor lacus at turpis donec posuere,924,false,2024-08-02 21:40:02
60,706,Message,in magna bibendum imperdiet nullam orci pede venenatis non sodales sed tincidunt eu felis fusce posuere,629,false,2024-07-16 04:36:19
61,236,Message,erat nulla tempus vivamus in,333,false,2024-02-07 15:20:43
62,502,Message,semper interdum mauris ullamcorper purus sit amet nulla quisque arcu libero rutrum ac,45,true,2024-11-24 18:51:21
63,654,Message,viverra pede ac diam cras pellentesque volutpat,48,false,2024-03-01 19:07:49
64,56,Message,magnis dis parturient montes nascetur ridiculus mus etiam,626,true,2024-02-28 21:25:33
65,363,Message,pharetra magna ac consequat metus sapien ut nunc vestibulum ante ipsum primis in faucibus orci,118,false,2024-06-24 13:53:46
66,187,Message,ultrices enim lorem ipsum dolor sit amet consectetuer adipiscing elit,662,false,2024-04-02 12:00:00
67,906,Message,leo maecenas pulvinar lobortis est phasellus sit amet erat nulla tempus vivamus in felis eu sapien cursus vestibulum proin,136,false,2024-02-04 07:16:18
68,563,Message,sed lacus morbi sem mauris laoreet ut rhoncus aliquet pulvinar sed nisl nunc rhoncus dui,609,false,2024-07-06 22:57:12
69,350,Message,orci eget orci vehicula condimentum curabitur,381,false,2024-08-09 21:07:00
70,347,Message,et ultrices posuere cubilia curae donec pharetra magna vestibulum aliquet ultrices erat tortor sollicitudin mi,674,false,2024-03-23 19:28:20
71,350,Message,porttitor lacus at turpis donec posuere metus vitae ipsum aliquam non mauris,542,true,2024-02-18 17:01:00
72,180,Message,eu magna vulputate luctus cum sociis natoque penatibus et magnis,788,true,2024-09-04 06:42:58
73,482,Message,et ultrices posuere cubilia curae duis faucibus accumsan odio curabitur convallis duis consequat dui nec nisi,361,true,2024-09-01 17:23:42
74,224,Message,et magnis dis parturient montes nascetur ridiculus mus vivamus vestibulum sagittis sapien cum sociis natoque penatibus,108,true,2024-11-23 06:33:16
75,910,Message,erat tortor sollicitudin mi sit amet lobortis sapien sapien non mi,299,true,2024-08-05 23:48:18
76,861,Message,integer aliquet massa id lobortis convallis tortor risus dapibus augue,256,false,2024-03-02 21:22:10
77,414,Message,penatibus et magnis dis parturient,859,false,2024-09-18 17:14:09
78,673,Message,augue luctus tincidunt nulla mollis molestie lorem quisque ut erat curabitur gravida nisi at nibh in hac habitasse platea,439,false,2024-08-02 11:25:33
79,343,Message,est risus auctor sed tristique in tempus sit amet sem fusce consequat nulla,29,false,2024-06-14 01:12:41
80,353,Message,cubilia curae mauris viverra diam vitae quam suspendisse,396,false,2024-04-29 09:32:44
81,126,Message,donec posuere metus vitae ipsum aliquam non mauris morbi,218,false,2024-12-14 08:44:56
82,780,Message,vestibulum sagittis sapien cum sociis natoque penatibus et magnis,780,false,2024-12-18 12:28:43
83,201,Message,pulvinar lobortis est phasellus sit amet erat nulla,444,false,2024-06-24 07:23:53
84,768,Message,suspendisse potenti cras in purus eu,690,false,2024-05-10 02:44:59
85,137,Message,consectetuer adipiscing elit proin interdum mauris non ligula pellentesque ultrices phasellus id sapien in sapien iaculis,938,true,2024-12-18 21:39:00
86,492,Message,suspendisse accumsan tortor quis turpis sed ante vivamus tortor duis mattis egestas metus aenean fermentum donec ut mauris eget massa,82,true,2024-05-14 17:43:58
87,676,Message,libero quis orci nullam molestie nibh in lectus pellentesque at nulla suspendisse,802,true,2024-01-03 03:13:32
88,954,Message,velit id pretium iaculis diam erat fermentum justo nec condimentum neque sapien placerat ante nulla justo aliquam quis turpis,291,true,2024-03-30 08:13:34
89,159,Message,in libero ut massa volutpat convallis,261,true,2024-02-09 18:51:53
90,355,Message,fermentum justo nec condimentum neque sapien placerat ante nulla,329,false,2024-05-01 00:57:42
91,978,Message,morbi vel lectus in quam fringilla rhoncus mauris enim leo rhoncus sed vestibulum,566,true,2024-06-25 04:34:36
92,650,Message,magna vestibulum aliquet ultrices erat tortor sollicitudin mi sit amet lobortis sapien sapien non mi integer ac neque duis bibendum,558,true,2024-08-06 23:06:35
93,450,Message,natoque penatibus et magnis dis parturient montes nascetur ridiculus mus,312,false,2024-01-02 14:30:35
94,560,Message,accumsan odio curabitur convallis duis consequat dui nec nisi volutpat eleifend donec ut dolor morbi vel lectus in,271,true,2024-10-10 16:32:04
95,270,Message,accumsan tortor quis turpis sed ante vivamus,769,false,2024-11-06 21:00:01
96,547,Message,blandit ultrices enim lorem ipsum dolor sit amet consectetuer,637,true,2024-11-18 15:01:15
97,162,Message,vehicula condimentum curabitur in libero ut massa volutpat convallis morbi,947,false,2024-01-12 15:49:20
98,232,Message,sed tincidunt eu felis fusce posuere felis,215,true,2024-11-07 17:14:07
99,291,Message,magnis dis parturient montes nascetur ridiculus mus,21,true,2024-05-01 03:18:44
100,434,Message,amet consectetuer adipiscing elit proin interdum mauris non ligula pellentesque ultrices phasellus id,328,false,2024-12-30 16:33:11
101,514,Message,ultrices aliquet maecenas leo odio condimentum id luctus nec molestie sed justo pellentesque viverra pede ac diam cras,884,false,2024-09-21 13:25:52
102,954,Message,est risus auctor sed tristique in tempus sit amet sem fusce consequat nulla nisl nunc nisl duis bibendum felis,865,false,2024-07-09 18:12:25
103,179,Message,in faucibus orci luctus et ultrices posuere cubilia curae mauris viverra diam vitae quam suspendisse potenti nullam,171,true,2024-09-21 01:01:47
104,497,Message,cras in purus eu magna vulputate luctus cum sociis,857,true,2024-09-08 14:51:28
105,116,Message,ante ipsum primis in faucibus,94,false,2024-07-07 22:07:57
106,762,Message,orci vehicula condimentum curabitur in libero ut massa volutpat convallis morbi,463,false,2024-02-25 09:39:16
107,25,Message,quisque erat eros viverra eget congue eget semper rutrum nulla nunc purus phasellus in felis donec semper sapien a,536,false,2024-04-07 17:26:43
108,989,Message,mauris viverra diam vitae quam,292,true,2024-06-21 15:42:48
109,163,Message,nulla dapibus dolor vel est donec odio justo sollicitudin ut suscipit a feugiat et eros vestibulum ac,671,false,2024-05-30 07:26:41
110,469,Message,ultrices aliquet maecenas leo odio condimentum id luctus nec molestie sed justo pellentesque viverra pede ac diam cras pellentesque,502,false,2024-06-20 04:13:57
111,853,Message,vehicula condimentum curabitur in libero ut massa volutpat convallis morbi odio odio elementum eu interdum eu tincidunt in leo,374,true,2024-08-08 22:05:12
112,442,Message,curae nulla dapibus dolor vel est donec odio justo sollicitudin ut suscipit a feugiat et,362,true,2024-12-30 14:06:19
113,955,Message,aliquam lacus morbi quis tortor id nulla,137,true,2024-01-24 00:10:31
114,926,Message,at nulla suspendisse potenti cras in purus eu magna,484,false,2024-09-23 12:34:22
115,54,Message,odio cras mi pede malesuada in imperdiet et commodo vulputate justo in blandit ultrices enim,426,true,2024-07-07 10:53:52
116,368,Message,urna pretium nisl ut volutpat sapien arcu sed augue aliquam erat volutpat in congue etiam justo etiam pretium,170,false,2024-08-25 01:12:04
117,260,Message,consectetuer adipiscing elit proin risus praesent lectus vestibulum quam sapien varius ut blandit,229,true,2024-09-20 08:32:25
118,707,Message,donec ut dolor morbi vel lectus in quam fringilla,62,false,2024-11-18 22:33:32
119,691,Message,rutrum ac lobortis vel dapibus at diam nam tristique tortor eu pede,998,true,2024-02-26 11:02:48
120,288,Message,sem praesent id massa id nisl venenatis lacinia aenean sit amet,259,true,2024-04-20 16:01:19
121,569,Message,sodales sed tincidunt eu felis fusce posuere felis sed lacus morbi sem mauris laoreet ut rhoncus,951,true,2024-09-27 14:00:17
122,233,Message,in tempus sit amet sem fusce consequat nulla nisl nunc nisl duis bibendum felis sed interdum venenatis turpis enim,490,true,2024-04-18 00:12:57
123,343,Message,sit amet nulla quisque arcu,10,false,2024-04-29 00:07:30
124,331,Message,facilisi cras non velit nec nisi vulputate nonummy maecenas tincidunt lacus at velit vivamus,803,true,2024-12-20 12:44:51
125,286,Message,convallis tortor risus dapibus augue vel accumsan tellus nisi eu orci,902,true,2024-08-28 04:36:21
126,154,Message,etiam faucibus cursus urna ut tellus nulla ut erat id mauris,117,false,2024-05-06 18:31:55
127,505,Message,eget eleifend luctus ultricies eu nibh quisque id justo sit,9,false,2024-06-10 22:13:07
128,511,Message,venenatis non sodales sed tincidunt eu felis fusce posuere felis sed lacus morbi,589,false,2024-06-07 22:11:11
129,274,Message,adipiscing molestie hendrerit at vulputate vitae nisl aenean lectus pellentesque eget,657,false,2024-02-11 20:59:03
130,531,Message,interdum mauris non ligula pellentesque ultrices phasellus id sapien in sapien iaculis congue vivamus metus,40,true,2024-01-31 16:03:42
131,424,Message,orci nullam molestie nibh in lectus pellentesque at nulla suspendisse potenti cras in purus eu,622,true,2024-04-02 13:11:47
132,223,Message,ac nulla sed vel enim sit amet,368,true,2024-04-04 16:57:16
133,567,Message,primis in faucibus orci luctus et ultrices,837,false,2024-09-01 13:17:02
134,240,Message,elementum ligula vehicula consequat morbi a ipsum integer a nibh,658,false,2024-11-26 07:06:26
135,836,Message,maecenas pulvinar lobortis est phasellus sit amet erat nulla tempus vivamus in felis eu sapien cursus,734,false,2024-06-11 14:07:37
136,58,Message,lacus curabitur at ipsum ac tellus,722,false,2024-05-06 11:56:31
137,34,Message,molestie nibh in lectus pellentesque at nulla suspendisse potenti,86,false,2024-05-18 13:29:38
138,61,Message,rhoncus aliquet pulvinar sed nisl nunc rhoncus dui vel sem sed sagittis,442,false,2024-11-22 16:32:16
139,333,Message,eu nibh quisque id justo sit amet sapien dignissim vestibulum vestibulum ante ipsum primis in faucibus orci,793,false,2024-10-17 19:24:51
140,378,Message,fermentum donec ut mauris eget massa tempor convallis nulla neque libero convallis,53,true,2024-03-27 03:57:48
141,231,Message,faucibus orci luctus et ultrices posuere cubilia curae mauris viverra diam vitae quam suspendisse potenti nullam porttitor,819,true,2024-01-06 21:29:39
142,996,Message,libero non mattis pulvinar nulla pede ullamcorper augue a,915,false,2024-08-08 14:23:46
143,261,Message,bibendum felis sed interdum venenatis turpis enim blandit mi in,92,true,2024-04-14 12:11:43
144,625,Message,pulvinar sed nisl nunc rhoncus dui vel sem,820,false,2024-02-26 14:52:09
145,25,Message,sagittis nam congue risus semper porta volutpat quam pede lobortis ligula sit amet eleifend pede libero quis,994,true,2024-09-18 14:16:49
146,234,Message,neque sapien placerat ante nulla justo aliquam quis turpis eget elit sodales scelerisque mauris sit amet eros suspendisse,415,false,2024-02-13 04:52:55
147,970,Message,nibh quisque id justo sit amet sapien dignissim vestibulum,760,false,2024-03-24 21:05:12
148,228,Message,nulla mollis molestie lorem quisque ut erat curabitur gravida nisi at nibh in hac habitasse platea dictumst aliquam augue quam,130,true,2024-03-09 08:25:25
149,616,Message,non interdum in ante vestibulum ante ipsum,137,true,2024-10-06 12:06:13
150,864,Message,vulputate elementum nullam varius nulla,470,false,2024-10-30 07:11:31
151,385,Message,ligula pellentesque ultrices phasellus id sapien in sapien iaculis congue vivamus metus arcu adipiscing,791,true,2024-11-11 09:54:13
152,267,Message,commodo vulputate justo in blandit ultrices enim lorem ipsum dolor sit amet consectetuer adipiscing elit proin interdum mauris non,387,false,2024-04-04 03:07:42
153,214,Message,ac tellus semper interdum mauris ullamcorper purus,798,false,2024-06-09 19:10:13
154,922,Message,ac leo pellentesque ultrices mattis odio donec vitae nisi nam ultrices libero non mattis pulvinar nulla pede ullamcorper augue a,160,true,2024-12-29 16:06:21
155,896,Message,diam cras pellentesque volutpat dui,356,true,2024-07-28 17:08:48
156,182,Message,vestibulum velit id pretium iaculis diam erat fermentum justo nec condimentum neque sapien placerat ante nulla justo aliquam quis turpis,956,true,2024-11-22 21:43:02
157,38,Message,donec dapibus duis at velit eu est congue elementum in hac habitasse platea dictumst morbi vestibulum velit,809,true,2024-03-13 16:51:58
158,746,Message,eu est congue elementum in hac habitasse platea dictumst morbi vestibulum velit id pretium iaculis diam erat fermentum justo,131,true,2024-12-16 20:46:21
159,749,Message,suspendisse potenti in eleifend quam a odio in hac habitasse platea dictumst maecenas ut massa quis augue,978,true,2024-05-30 16:55:46
160,397,Message,in tempor turpis nec euismod,31,true,2024-08-22 21:35:07
161,335,Message,quisque porta volutpat erat quisque erat eros viverra eget congue eget semper rutrum,104,false,2024-12-09 15:21:01
162,460,Message,pretium quis lectus suspendisse potenti in eleifend quam a odio in hac habitasse platea dictumst maecenas,794,true,2024-03-04 07:13:15
163,934,Message,ipsum dolor sit amet consectetuer adipiscing elit proin interdum mauris non ligula pellentesque ultrices phasellus id sapien,679,true,2024-08-12 05:30:36
164,90,Message,accumsan odio curabitur convallis duis consequat dui,704,false,2024-01-22 10:11:57
165,958,Message,turpis donec posuere metus vitae ipsum aliquam non mauris,580,false,2024-03-11 02:57:08
166,692,Message,lacinia nisi venenatis tristique fusce congue diam id ornare imperdiet sapien urna pretium nisl ut volutpat sapien,268,false,2024-10-06 23:38:02
167,595,Message,et magnis dis parturient montes nascetur ridiculus mus vivamus vestibulum sagittis sapien cum sociis natoque penatibus et magnis dis,24,false,2024-10-24 08:47:32
168,919,Message,vehicula consequat morbi a ipsum integer a nibh in quis justo maecenas rhoncus aliquam lacus morbi quis,699,true,2024-11-30 16:45:29
169,440,Message,lorem ipsum dolor sit amet consectetuer adipiscing elit proin risus praesent lectus vestibulum quam sapien,286,false,2024-08-26 16:51:23
170,454,Message,fringilla rhoncus mauris enim leo rhoncus sed vestibulum sit,702,false,2024-01-31 09:13:53
171,514,Message,sollicitudin ut suscipit a feugiat et eros vestibulum ac est lacinia nisi venenatis tristique fusce,995,true,2024-02-28 04:22:46
172,178,Message,nibh ligula nec sem duis aliquam convallis nunc proin at turpis a pede posuere nonummy integer non velit,664,true,2024-02-24 02:36:21
173,658,Message,imperdiet sapien urna pretium nisl ut volutpat sapien arcu sed augue aliquam erat,567,false,2024-07-27 20:45:49
174,633,Message,lobortis ligula sit amet eleifend pede libero quis orci nullam molestie nibh in lectus pellentesque at nulla suspendisse potenti cras,651,true,2024-02-06 06:13:27
175,948,Message,donec diam neque vestibulum eget vulputate ut ultrices vel augue vestibulum ante ipsum primis in faucibus orci luctus et,815,true,2024-07-30 02:10:35
176,874,Message,ipsum primis in faucibus orci luctus et ultrices posuere cubilia curae mauris viverra,235,true,2024-08-01 04:45:30
177,993,Message,erat nulla tempus vivamus in felis eu sapien cursus,264,false,2024-05-10 11:27:14
178,501,Message,sodales sed tincidunt eu felis fusce posuere felis sed lacus morbi sem mauris laoreet ut rhoncus,773,true,2024-01-28 23:29:49
179,518,Message,luctus et ultrices posuere cubilia curae nulla dapibus dolor vel est donec odio justo sollicitudin ut suscipit a feugiat,352,false,2024-10-12 22:15:10
180,647,Message,fusce lacus purus aliquet at feugiat non pretium quis lectus suspendisse,818,false,2024-02-06 20:51:26
181,600,Message,accumsan felis ut at dolor quis,137,false,2024-08-09 09:02:36
182,537,Message,egestas metus aenean fermentum donec ut mauris eget massa tempor convallis nulla neque,251,true,2024-10-08 08:45:57
183,17,Message,venenatis tristique fusce congue diam id ornare imperdiet sapien,55,false,2024-10-19 08:27:48
184,627,Message,mus etiam vel augue vestibulum rutrum rutrum neque aenean auctor gravida sem praesent id massa id nisl venenatis lacinia,848,false,2024-12-06 03:16:24
185,452,Message,nunc purus phasellus in felis donec semper,402,false,2024-11-18 05:39:03
186,244,Message,rutrum neque aenean auctor gravida sem praesent id massa id nisl,870,false,2024-05-30 03:48:36
187,933,Message,libero nam dui proin leo odio porttitor id consequat,119,true,2024-02-10 14:45:41
188,2,Message,tortor risus dapibus augue vel accumsan tellus nisi eu orci mauris lacinia sapien quis,89,false,2024-11-08 13:39:32
189,345,Message,ultrices posuere cubilia curae duis faucibus accumsan odio curabitur convallis duis consequat dui nec nisi volutpat eleifend,630,false,2024-10-21 05:42:57
190,295,Message,vulputate luctus cum sociis natoque penatibus et magnis dis parturient,848,false,2024-09-01 03:47:11
191,790,Message,justo maecenas rhoncus aliquam lacus morbi quis tortor id nulla ultrices aliquet maecenas,128,true,2024-03-17 23:10:09
192,244,Message,quis orci eget orci vehicula condimentum curabitur in libero ut massa volutpat convallis,713,true,2024-07-09 06:31:48
193,238,Message,velit vivamus vel nulla eget eros elementum pellentesque,540,true,2024-07-20 20:30:36
194,487,Message,congue eget semper rutrum nulla nunc purus phasellus in felis donec semper sapien a libero nam dui proin leo odio,272,false,2024-01-15 13:52:18
195,132,Message,euismod scelerisque quam turpis adipiscing lorem,715,false,2024-04-23 18:56:55
196,741,Message,semper porta volutpat quam pede lobortis ligula sit amet eleifend pede libero quis orci nullam molestie nibh in lectus,420,true,2024-06-02 20:57:26
197,755,Message,curabitur at ipsum ac tellus semper interdum mauris ullamcorper purus sit amet,926,false,2024-05-04 17:37:24
198,886,Message,primis in faucibus orci luctus et ultrices posuere cubilia curae nulla dapibus dolor vel est donec odio justo,335,false,2024-10-14 07:34:49
199,95,Message,potenti in eleifend quam a odio in hac habitasse platea,593,false,2024-07-30 16:06:00
200,727,Message,maecenas ut massa quis augue luctus tincidunt nulla mollis molestie lorem quisque ut erat curabitur gravida nisi at nibh in,949,false,2024-05-06 23:04:50
201,493,Message,magna vestibulum aliquet ultrices erat tortor sollicitudin mi sit amet lobortis sapien sapien non mi integer ac,805,true,2024-06-11 17:16:38
202,580,Message,eu nibh quisque id justo sit amet sapien dignissim vestibulum vestibulum ante ipsum primis in faucibus orci luctus et ultrices,26,false,2024-03-16 02:05:41
203,782,Message,duis ac nibh fusce lacus purus aliquet at feugiat,998,true,2024-05-15 09:57:18
204,616,Message,convallis nunc proin at turpis a pede posuere nonummy integer non velit donec,90,true,2024-09-02 06:55:29
205,812,Message,molestie lorem quisque ut erat curabitur gravida,304,true,2024-12-16 20:57:21
206,677,Message,ornare imperdiet sapien urna pretium nisl ut volutpat sapien arcu sed,642,true,2024-11-27 14:08:11
